item,filename,article_title,in_folder,notes
2,2 - MOVING FROM MULTI-CHANNEL TO OMNI-CHANNEL RETAILING SPECIAL ISSUE INTRODUCTION.pdf,MOVING FROM MULTI-CHANNEL TO OMNI-CHANNEL RETAILING: SPECIAL ISSUE INTRODUCTION,YES,On Google Drive Folder
3,,THE IMPACT OF OMNI-CHANNEL COLLABORATIVE MARKETING ON CUSTOMER LOYALTY TO FRESH RETAILERS: THE MEDIATING EFFECT OF THE OMNI-CHANNEL SHOPPING EXPERIENCE,NO,Dr. Gibson's folder
4,4 - EXPLORING OMNI-CHANNELS FOR CUSTOMER-CENTRIC E-TAILING.pdf,EXPLORING OMNI-CHANNELS FOR CUSTOMER-CENTRIC E-TAILING,YES,On Google Drive Folder
5,,TOWARD A THREE-DIMENSIONAL FRAMEWORK FOR OMNI-CHANNEL,NO,Dr. Gibson's folder
6,,DYNAMIC PRICING AND CROSS-CHANNEL FULFILLMENT FOR OMNICHANNEL RETAILING INDUSTRY: AN APPROXIMATION POLICY AND IMPLICATIONS,NO,Dr. Gibson's folder
7,,UNDERSTANDING OMNI-CHANNEL SHOPPING VALUE: A MIXED-METHOD STUDY,NO,Dr. Gibson's folder
8,,REVEALING THE IMPACT OF OPERATIONAL LOGISTICS SERVICE QUALITY ON OMNI-CHANNEL CAPABILITY,NO,Dr. Gibson's folder
9,9 - CRITICAL OMNI-CHANNEL SERVICE ELEMENTS AFFECTING SATISFACTION AND LOYALTY.pdf,CRITICAL OMNI-CHANNEL SERVICE ELEMENTS AFFECTING SATISFACTION AND LOYALTY, ,On Google Drive Folder
10,10 - ANALYZING THE OMNI-CHANNEL SHOPPER JOURNEY CONFIGURATION OF GENERATIONS Y AND Z.pdf,ANALYZING THE OMNI-CHANNEL SHOPPER JOURNEY CONFIGURATION OF GENERATIONS Y AND Z,YES,On Google Drive Folder
11,,"WEBROOMING OR SHOWROOMING, THAT IS THE QUESTION: EXPLAINING OMNICHANNEL BEHAVIOURAL INTENTION THROUGH THE TECHNOLOGY ACCEPTANCE MODEL AND EXPLORATORY BEHAVIOUR", ,Dr. Gibson's folder
12,12 - WIELD THE POWER OF OMNI-CHANNEL RETAILING STRATEGY A CAPABILITY AND SUPPLY CHAIN RESILIENCE PERSPECTIVE.pdf,WIELD THE POWER OF OMNI-CHANNEL RETAILING STRATEGY: A CAPABILITY AND SUPPLY CHAIN RESILIENCE PERSPECTIVE,YES,On Google Drive Folder
13,,THE MEDIATING ROLE OF PERCEIVED ENJOYMENT AND ATTITUDE CONSISTENCY IN OMNI-CHANNEL RETAILING,NO,Cancelled by ILL Staff
14,,THE EFFECTS OF OMNI-CHANNEL RETAILING ON PROMOTIONAL STRATEGY,NO,Dr. Gibson's folder
15,,"A FURTHER APPROACH IN OMNICHANNEL LSQ, SATISFACTION AND CUSTOMER LOYALTY",NO,Dr. Gibson's folder
16,,A SYSTEMATIC LITERATURE REVIEW ON E-COMMERCE LOGISTICS: TOWARDS AN E-COMMERCE AND OMNI-CHANNEL DECISION FRAMEWORK,NO,Cancelled by ILL Staff
17,,ANALYSING THE IMPACT OF OMNI-CHANNEL CUSTOMER DELIGHT ON REPURCHASE INTENTION,NO,Dr. Gibson's folder
18,,AN INTEGRATED RANDOMIZED PRICING STRATEGY FOR OMNI-CHANNEL RETAILING,NO,Dr. Gibson's folder
19,,INVESTIGATING LOGISTICS SERVICE QUALITY IN OMNI-CHANNEL RETAILING,NO,Dr. Gibson's folder
20,,EXECUTION OF OMNI-CHANNEL RETAILING BASED ON A PRACTICAL ORDER FULFILLMENT POLICY,NO,Dr. Gibson's folder
21,21 - UNRAVELLING CONSUMER RESPONSES TO OMNI-CHANNEL APPROACH.pdf,UNRAVELLING CONSUMER RESPONSES TO OMNI-CHANNEL APPROACH,YES,On Google Drive Folder
22,22 - OMNI-CHANNEL RETAILING SOME REFLECTIONS .pdf,OMNI-CHANNEL RETAILING: SOME REFLECTIONS,YES,On Google Drive Folder
23,23 - OMNI-CHANNEL STRATEGIES FOR FRESH PRODUCE WITH EXTRA LOSSES IN-STORE.pdf,OMNI-CHANNEL STRATEGIES FOR FRESH PRODUCE WITH EXTRA LOSSES IN-STORE,YES,On Google Drive Folder
24,24 - MULTIPLE CHANNEL STRATEGY SELECTION A ROADMAP PERSPECTIVE FOR BRICK-AND-CLICK RETAILERS.pdf,MULTIPLE CHANNEL STRATEGY SELECTION: A ROADMAP PERSPECTIVE FOR BRICK-AND-CLICK RETAILERS,YES,On Google Drive Folder
25,25 - SERVICE QUALITY MEASUREMENT FOR OMNI-CHANNEL RETAIL SCALE DEVELOPMENT AND VALIDATION.pdf,SERVICE QUALITY MEASUREMENT FOR OMNI-CHANNEL RETAIL: SCALE DEVELOPMENT AND VALIDATION,YES,On Google Drive Folder
26,"26 - THE DRIVERS OF OMNI-CHANNEL SHOPPING INTENTION A CASE STUDY FOR FASHION RETAILING SECTOR IN DANANG, VIETNAM.pdf","THE DRIVERS OF OMNI-CHANNEL SHOPPING INTENTION: A CASE STUDY FOR FASHION RETAILING SECTOR IN DANANG, VIETNAM",YES,On Google Drive Folder
27,,THE IMPACT OF CHANNEL INTEGRATION ON CONSUMER RESPONSES IN OMNICHANNEL RETAILING: THE MEDIATING EFFECT OF CONSUMER EMPOWERMENT,NO,On Google Drive Folder
28,28 - MEASURING RETAIL PERFORMANCE IN AN OMNI-CHANNEL WORLD.pdf,MEASURING RETAIL PERFORMANCE IN AN OMNI-CHANNEL WORLD,YES,On Google Drive Folder
29,"29 - SOCIAL, LOCAL AND MOBILE COMMERCE PRACTICES IN OMNI-CHANNEL RETAILING INSIGHTS FROM GERMANY AND TURKEY.pdf","SOCIAL, LOCAL AND MOBILE COMMERCE PRACTICES IN OMNI-CHANNEL RETAILING INSIGHTS FROM GERMANY AND TURKEY",YES,On Google Drive Folder
30,30 - AN EXAMINATION OF THE EFFECTS OF OMNI-CHANNEL SERVICE OFFERINGS ON RETAILER PERFORMANCE.pdf,AN EXAMINATION OF THE EFFECTS OF OMNI-CHANNEL SERVICE OFFERINGS ON RETAILER PERFORMANCE,YES,On Google Drive Folder
31,,OMNI CHANNEL: IS IT REALLY OMNI?,NO,On Google Drive Folder
32,32 - FROM AMBITION TO ACTION HOW TO ACHIEVE INTEGRATION IN OMNI-CHANNEL.pdf,FROM AMBITION TO ACTION: HOW TO ACHIEVE INTEGRATION IN OMNI-CHANNEL?,YES,On Google Drive Folder
33,33 - DO CUSTOMERS ALWAYS ADOPT BUY-ONLINE-AND-PICK-UP-IN-STORE SERVICE CONSIDERATION OF LOCATION-BASED STORE DENSITY IN OMNI-CHANNEL RETAILING.pdf,DO CUSTOMERS ALWAYS ADOPT BUY-ONLINE-AND-PICK-UP-IN-STORE SERVICE? CONSIDERATION OF LOCATION-BASED STORE DENSITY IN OMNI-CHANNEL RETAILING,YES,On Google Drive Folder
34,34 - TOWARD THE INTER-CHANNEL SYNERGY RENAISSANCE IN EMERGING MARKETS EVIDENCE FROM ADDING CLICKS TO BRICKS IN SERBIA.pdf,TOWARD THE INTER-CHANNEL SYNERGY RENAISSANCE IN EMERGING MARKETS: EVIDENCE FROM ADDING CLICKS TO BRICKS IN SERBIA,YES,On Google Drive Folder
35,35 - TRANSITIONS TOWARDS OMNI-CHANNEL RETAILING STRATEGIES A BUSINESS MODEL PERSPECTIVE.pdf,TRANSITIONS TOWARDS OMNI-CHANNEL RETAILING STRATEGIES: A BUSINESS MODEL PERSPECTIVE,YES,On Google Drive Folder
36,36 - OMNI-CHANNEL CAPABILITY AND CUSTOMER SATISFACTION MEDIATING ROLES OF FLEXIBILITY AND OPERATIONAL LOGISTICS SERVICE QUALITY.pdf,OMNI-CHANNEL CAPABILITY AND CUSTOMER SATISFACTION: MEDIATING ROLES OF FLEXIBILITY AND OPERATIONAL LOGISTICS SERVICE QUALITY,YES,On Google Drive Folder
37,37 - DRIVERS AND BARRIERS OF OMNI-CHANNEL RETAILING IN CHINA A CASE STUDY OF THE FASHION AND APPAREL INDUSTRY.pdf,DRIVERS AND BARRIERS OF OMNI-CHANNEL RETAILING IN CHINA A CASE STUDY OF THE FASHION AND APPAREL INDUSTRY,YES,On Google Drive Folder
38,"38 - CATEGORIZATION OF MULTIPLE CHANNEL RETAILING IN MULTI-, CROSS-, AND OMNI-CHANNEL RETAILING FOR RETAILERS AND RETAILING.pdf","CATEGORIZATION OF MULTIPLE CHANNEL RETAILING IN MULTI-, CROSS-, AND OMNI-CHANNEL RETAILING FOR RETAILERS AND RETAILING",YES,On Google Drive Folder
39,39 - WAREHOUSE CONFIGURATION IN OMNI-CHANNEL RETAILING A MULTIPLE CASE STUDY.pdf,WAREHOUSE CONFIGURATION IN OMNI-CHANNEL RETAILING: A MULTIPLE CASE STUDY,YES,On Google Drive Folder
40,40 - OMNI-CHANNEL RETAILING RESEARCH - STATE OF THE ART AND INTELLECTUAL FOUNDATION.pdf,OMNI-CHANNEL RETAILING RESEARCH - STATE OF THE ART AND INTELLECTUAL FOUNDATION,YES,On Google Drive Folder
41,41 - CHANNEL DESIGN TO ENRICH CUSTOMERS_ SHOPPING EXPERIENCES.pdf,CHANNEL DESIGN TO ENRICH CUSTOMERS' SHOPPING EXPERIENCES SYNCHRONIZING CLICKS WITH BRICKS IN AN OMNI-CHANNEL PERSPECTIVE - THE DIRECT OPTIC CASE,YES,On Google Drive Folder
42,"42 - OMNICHANNEL MARKETING STRUCTURED REVIEW, SYNTHESIS, AND FUTURE DIRECTIONS.pdf","OMNICHANNEL MARKETING: STRUCTURED REVIEW, SYNTHESIS, AND FUTURE DIRECTIONS",YES,On Google Drive Folder
43,"43 - DEVELOPING TRENDS IN SHOWROOMING, WEBROOMING, AND OMNICHANNEL SHOPPING BEHAVIORS.pdf","DEVELOPING TRENDS IN SHOWROOMING, WEBROOMING, AND OMNICHANNEL SHOPPING BEHAVIORS: PERFORMANCE ANALYSIS, CONCEPTUAL MAPPING, AND FUTURE DIRECTIONS",YES,On Google Drive Folder
44,44 - AN INVESTIGATION OF CONSUMERS_ PURCHASE INTENTIONS TOWARDS OMNI-CHANNEL SHOPPING.pdf,AN INVESTIGATION OF CONSUMERS' PURCHASE INTENTIONS TOWARDS OMNI-CHANNEL SHOPPING: A QUALITATIVE EXPLORATORY STUDY,YES,On Google Drive Folder
45,45 - OMNI-CHANNEL MARKETING STRATEGY IN THE DIGITAL PLATFORM ERA.pdf,OMNI-CHANNEL MARKETING STRATEGY IN THE DIGITAL PLATFORM ERA,YES,On Google Drive Folder
46,46 - PERCEIVED CONSUMER VALUE OF OMNI-CHANNEL SERVICE ATTRIBUTES IN JAPAN AND KOREA.pdf,PERCEIVED CONSUMER VALUE OF OMNI-CHANNEL SERVICE ATTRIBUTES IN JAPAN AND KOREA,YES,On Google Drive Folder
47,,PHYSICAL OR VIRTUAL SHOWROOM? THE DECISION FOR OMNI-CHANNEL RETAILERS IN THE CONTEXT OF CROSS-CHANNEL FREE-RIDING,NO,On Google Drive Folder
48,48 - HOW TO RETAIN CUSTOMERS IN OMNICHANNEL RETAILING CONSIDERING THE ROLES OF BRAND EXPERIENCE AND PURCHASE BEHAVIOR.pdf,HOW TO RETAIN CUSTOMERS IN OMNICHANNEL RETAILING: CONSIDERING THE ROLES OF BRAND EXPERIENCE AND PURCHASE BEHAVIOR,YES,On Google Drive Folder
49,49 - FROM MULTI-CHANNEL RETAILING TO OMNI-CHANNEL RETAILING.pdf,FROM MULTI-CHANNEL RETAILING TO OMNI-CHANNEL RETAILING INTRODUCTION TO THE SPECIAL ISSUE ON MULTI-CHANNEL RETAILING,YES,On Google Drive Folder
50,50 - REALIGNMENT OF THE PHYSICAL DISTRIBUTION PROCESS IN OMNI-CHANNEL FULFILLMENT.pdf,REALIGNMENT OF THE PHYSICAL DISTRIBUTION PROCESS IN OMNI-CHANNEL FULFILLMENT,YES,On Google Drive Folder
51,51 - INVESTIGATION AND ANALYSIS OF OMNICHANNEL LOGISTICS MODELS.pdf,INVESTIGATION AND ANALYSIS OF OMNICHANNEL LOGISTICS MODELS: A STUDY IN THE ELECTRONIC RETAIL INDUSTRY IN INDONESIA,YES,On Google Drive Folder
52,52 - INTEGRATED STORE SERVICE QUALITY MEASUREMENT SCALE IN OMNI-CHANNEL RETAILING.pdf,INTEGRATED STORE SERVICE QUALITY MEASUREMENT SCALE IN OMNI-CHANNEL RETAILING,YES,On Google Drive Folder
53,53 - UNDERSTANDING THE ANTECEDENTS OF OMNI-CHANNEL SHOPPING BY CUSTOMERS WITH REFERENCE TO FASHION CATEGORY.pdf,UNDERSTANDING THE ANTECEDENTS OF OMNI-CHANNEL SHOPPING BY CUSTOMERS WITH REFERENCE TO FASHION CATEGORY: THE INDIAN MILLENNIALS' PERSPECTIVE,YES,On Google Drive Folder
54,54 - OMNI-CHANNEL SERVICE FAILURES AND RECOVERIES - REFINED TYPOLOGIES USING FACEBOOK COMPLAINTS.pdf,OMNI-CHANNEL SERVICE FAILURES AND RECOVERIES: REFINED TYPOLOGIES USING FACEBOOK COMPLAINTS,YES,On Google Drive Folder
55,55 - OMNI-CHANNEL RETAILING WITH CONSUMER PREFERENCE AND CARBON EMISSION EFFORTS.pdf,OMNI-CHANNEL RETAILING WITH CONSUMER PREFERENCE AND CARBON EMISSION EFFORTS,YES,On Google Drive Folder
56,56 - DETERMINING SAFETY STOCK FOR AN OMNI-CHANNEL ENVIRONMENT.pdf,DETERMINING SAFETY STOCK FOR AN OMNI-CHANNEL ENVIRONMENT,YES,On Google Drive Folder
57,57 - THE OMNI-CHANNEL APPROACH - A UTOPIA FOR COMPANIES.pdf,THE OMNI-CHANNEL APPROACH: A UTOPIA FOR COMPANIES?,YES,On Google Drive Folder
58,58 - OMNICHANNEL BUSINESS.pdf,OMNICHANNEL BUSINESS,YES,On Google Drive Folder
59,59 - DOES RETAIL TYPE MATTER CONSUMER RESPONSES TO CHANNEL INTEGRATION IN OMNI-CHANNEL RETAILING.pdf,DOES RETAIL TYPE MATTER? CONSUMER RESPONSES TO CHANNEL INTEGRATION IN OMNI-CHANNEL RETAILING,YES,On Google Drive Folder
60,60 - A DECISION-MAKING FRAMEWORK FOR INVENTORY POSITIONING IN AN OMNICHANNEL BUSINESS ENVIRONMENT.pdf,A DECISION-MAKING FRAMEWORK FOR INVENTORY POSITIONING IN AN OMNICHANNEL BUSINESS ENVIRONMENT,YES,On Google Drive Folder
61,61 - A QUANTITATIVE PERFORMANCE MANAGEMENT FRAMEWORK FOR ASSESSING OMNICHANNEL RETAIL SUPPLY CHAINS.pdf,A QUANTITATIVE PERFORMANCE MANAGEMENT FRAMEWORK FOR ASSESSING OMNICHANNEL RETAIL SUPPLY CHAINS,YES,On Google Drive Folder
62,62 - ADAPTING WAREHOUSE OPERATIONS AND DESIGN TO OMNI-CHANNEL LOGISTICS.pdf,ADAPTING WAREHOUSE OPERATIONS AND DESIGN TO OMNI-CHANNEL LOGISTICS: A LITERATURE REVIEW AND RESEARCH AGENDA,YES,On Google Drive Folder
63,63 - ROLE OF BIGDATA ANALYTICS IN IMPROVING DRIVERS OF OMNI-CHANNEL RETAILING FOR IMPROVING LOGISTICS EXPERIENCE.pdf,ROLE OF BIGDATA ANALYTICS IN IMPROVING DRIVERS OF OMNI-CHANNEL RETAILING FOR IMPROVING LOGISTICS EXPERIENCE,YES,On Google Drive Folder
64,64 - MANAGING MULTI- AND OMNI-CHANNEL DISTRIBUTION - METRICS AND RESEARCH DIRECTIONS.pdf,MANAGING MULTI- AND OMNI-CHANNEL DISTRIBUTION: METRICS AND RESEARCH DIRECTIONS,YES,On Google Drive Folder
65,"65 - THE VALUE PROPOSITIONS OF MULTI-, CROSS-, AND OMNI-CHANNEL RETAILING.pdf","THE VALUE PROPOSITIONS OF MULTI-, CROSS-, AND OMNI-CHANNEL RETAILING",YES,On Google Drive Folder
66,66 - FASHION CONSUMERS_ CHANNEL-HOPPING PROFILES BY PSYCHOGRAPHICS AND DEMOGRAPHICS.pdf,FASHION CONSUMERS' CHANNEL-HOPPING PROFILES BY PSYCHOGRAPHICS AND DEMOGRAPHICS,YES,On Google Drive Folder
67,67 - OMNI-CHANNEL RESEARCH FRAMEWORK IN THE CONTEXT OF PERSONAL SELLING AND SALES MANAGEMENT.pdf,OMNI-CHANNEL RESEARCH FRAMEWORK IN THE CONTEXT OF PERSONAL SELLING AND SALES MANAGEMENT A REVIEW AND RESEARCH EXTENSIONS,YES,On Google Drive Folder
68,68 - SHOPPERS_ LOGISTICS ACTIVITIES IN OMNI-CHANNEL RETAILING A CONCEPTUALISATION AND AN EXPLORATION ON PERCEPTUAL DIFFERENCES IN EFFORT.pdf,SHOPPERS' LOGISTICS ACTIVITIES IN OMNI-CHANNEL RETAILING: A CONCEPTUALISATION AND AN EXPLORATION ON PERCEPTUAL DIFFERENCES IN EFFORT VALUATION,YES,On Google Drive Folder
69,69 - OPERATION STRATEGIES FOR AN OMNI-CHANNEL SUPPLY CHAIN.pdf,OPERATION STRATEGIES FOR AN OMNI-CHANNEL SUPPLY CHAIN: WHO IS BETTER OFF TAKING ON THE ONLINE CHANNEL AND OFFLINE SERVICE?,YES,On Google Drive Folder
70,"70 - PROVIDING A SYSTEM DYNAMICS MODEL TO EVALUATE TIME, COST, AND CUSTOMER SATISFACTION IN OMNI-CHANNEL DISTRIBUTION.pdf","PROVIDING A SYSTEM DYNAMICS MODEL TO EVALUATE TIME, COST, AND CUSTOMER SATISFACTION IN OMNI-CHANNEL DISTRIBUTION: A CASE STUDY",YES,On Google Drive Folder
71,,THE LONG ROAD TO OMNI-CHANNEL RETAILING: AN ASSESSMENT OF CHANNEL INTEGRATION LEVELS ACROSS FASHION AND APPAREL RETAILERS,NO,Cancelled by ILL Staff
72,72 - FOSTERING SUPPLY CHAIN INTEGRATION IN OMNI-CHANNEL RETAILING THROUGH HUMAN RESOURCE FACTORS EMPIRICAL STUDY IN CHINA_S MARKET.pdf,FOSTERING SUPPLY CHAIN INTEGRATION IN OMNI-CHANNEL RETAILING THROUGH HUMAN RESOURCE FACTORS: EMPIRICAL STUDY IN CHINA'S MARKET,YES,On Google Drive Folder
73,73 - OPTIMAL JOINT ASSORTMENT FOR AN OMNI-CHANNEL RETAILER.pdf,OPTIMAL JOINT ASSORTMENT FOR AN OMNI-CHANNEL RETAILER,YES,On Google Drive Folder
74,74 - THE HARMONIOUS ROLE OF CHANNEL INTEGRATION AND LOGISTICS SERVICE IN OMNICHANNEL RETAILING.pdf,THE HARMONIOUS ROLE OF CHANNEL INTEGRATION AND LOGISTICS SERVICE IN OMNICHANNEL RETAILING: THE CASE OF IKEA,YES,On Google Drive Folder
75,75 - OPTIMAL IN-STORE FULFILLMENT POLICIES FOR ONLINE ORDERS IN AN OMNI-CHANNEL RETAIL ENVIRONMENT.pdf,OPTIMAL IN-STORE FULFILLMENT POLICIES FOR ONLINE ORDERS IN AN OMNI-CHANNEL RETAIL ENVIRONMENT,YES,On Google Drive Folder
76,76 - OPTIMAL SERVICE DECISIONS IN AN OMNI-CHANNEL WITH BUY-ONLINE-AND-PICK-UP-IN-STORE.pdf,OPTIMAL SERVICE DECISIONS IN AN OMNI-CHANNEL WITH BUY-ONLINE-AND-PICK-UP-IN-STORE,YES,On Google Drive Folder
77,77 - ONLINE RETAIL RETURNS MANAGEMENT INTEGRATION WITHIN AN OMNI-CHANNEL DISTRIBUTION CONTEXT.pdf,ONLINE RETAIL RETURNS MANAGEMENT INTEGRATION WITHIN AN OMNI-CHANNEL DISTRIBUTION CONTEXT,YES,On Google Drive Folder
78,78 - DOES CROSS-CHANNEL CONSISTENCY ALWAYS CREATE BRAND LOYALTY IN OMNI-CHANNEL RETAILING.pdf,DOES CROSS-CHANNEL CONSISTENCY ALWAYS CREATE BRAND LOYALTY IN OMNI-CHANNEL RETAILING?,YES,On Google Drive Folder
79,79 - CAN_T TOUCH THIS CONCEPTUALIZING THE CUSTOMER TOUCHPOINT IN THE CONTEXT OF OMNI-CHANNEL RETAILING.pdf,CAN'T TOUCH THIS? CONCEPTUALIZING THE CUSTOMER TOUCHPOINT IN THE CONTEXT OF OMNI-CHANNEL RETAILING,YES,On Google Drive Folder
80,80 - OMNI-CHANNEL RETAILING RESOURCES AND CAPABILITIES OF SME SPECIALTY RETAILERS - INSIGHTS FROM GERMANY AND TURKEY.pdf,OMNI-CHANNEL RETAILING RESOURCES AND CAPABILITIES OF SME SPECIALTY RETAILERS - INSIGHTS FROM GERMANY AND TURKEY,YES,On Google Drive Folder
81,81 - CONSUMER INTER-PRODUCT SHOWROOMING AND INFORMATION SERVICE PROVISION IN AN OMNI-CHANNEL SUPPLY CHAIN.pdf,CONSUMER INTER-PRODUCT SHOWROOMING AND INFORMATION SERVICE PROVISION IN AN OMNI-CHANNEL SUPPLY CHAIN,YES,On Google Drive Folder
82,82 - FULFILLMENT AND PRICING OPTIMIZATION FOR OMNI-CHANNEL RETAILERS CONSIDERING SHIPMENT OF IN-STORE DEMAND.pdf,FULFILLMENT AND PRICING OPTIMIZATION FOR OMNI-CHANNEL RETAILERS CONSIDERING SHIPMENT OF IN-STORE DEMAND,YES,On Google Drive Folder
83,83 - OMNICHANNEL BANKING ECONOMY.pdf,OMNICHANNEL BANKING ECONOMY,YES,On Google Drive Folder
84,84 - OMNI-CHANNEL RETAILING AND DIGITAL BUSINESS - A CASE STUDY IN MALAYSIA.pdf,OMNI-CHANNEL RETAILING AND DIGITAL BUSINESS: A CASE STUDY IN MALAYSIA,YES,On Google Drive Folder
85,85 - CONTEXTUAL ADAPTATION OF OMNI-CHANNEL GROCERY RETAILERS ONLINE FULFILMENT CENTRES.pdf,CONTEXTUAL ADAPTATION OF OMNI-CHANNEL GROCERY RETAILERS' ONLINE FULFILMENT CENTRES,YES,On Google Drive Folder
86,86 - ASSORTMENT OPTIMIZATION IN OMNI-CHANNEL RETAILING.pdf,ASSORTMENT OPTIMIZATION IN OMNI-CHANNEL RETAILING,YES,On Google Drive Folder
87,87 - CUSTOMERS VALUATION OF TIME AND CONVENIENCE IN E-FULFILLMENT.pdf,CUSTOMERS' VALUATION OF TIME AND CONVENIENCE IN E-FULFILLMENT,YES,On Google Drive Folder
88,88 - INROAD INTO OMNI-CHANNEL RETAILING PHYSICAL SHOWROOM DEPLOYMENT OF AN ONLINE RETAILER.pdf,INROAD INTO OMNI-CHANNEL RETAILING: PHYSICAL SHOWROOM DEPLOYMENT OF AN ONLINE RETAILER,YES,On Google Drive Folder
89,89 - EFFECT OF CHANNEL INTEGRATION QUALITY ON CONSUMER RESPONSES WITHIN OMNI-CHANNEL RETAILING.pdf,EFFECT OF CHANNEL INTEGRATION QUALITY ON CONSUMER RESPONSES WITHIN OMNI-CHANNEL RETAILING,YES,On Google Drive Folder
90,90 - ARE PRIVACY CONCERNS STILL RELEVANT REVISITING CONSUMER BEHAVIOUR IN OMNICHANNEL RETAILING.pdf,ARE PRIVACY CONCERNS STILL RELEVANT? REVISITING CONSUMER BEHAVIOUR IN OMNICHANNEL RETAILING,YES,On Google Drive Folder
91,91 - CUSTOMER ENGAGEMENT THROUGH OMNICHANNEL RETAILING THE EFFECTS OF CHANNEL INTEGRATION QUALITY.pdf,CUSTOMER ENGAGEMENT THROUGH OMNICHANNEL RETAILING: THE EFFECTS OF CHANNEL INTEGRATION QUALITY,YES,On Google Drive Folder
92,92 - SHOULD SMALL-SCALE ONLINE RETAILERS DIVERSIFY DISTRIBUTION CHANNELS INTO OFFLINE CHANNELS.pdf,SHOULD SMALL-SCALE ONLINE RETAILERS DIVERSIFY DISTRIBUTION CHANNELS INTO OFFLINE CHANNELS? FOCUSED ON THE CLOTHING AND FASHION INDUSTRY,YES,On Google Drive Folder
93,93 - UNDER THE SWAY OF A MOBILE DEVICE DURING AN IN-STORE SHOPPING EXPERIENCE.pdf,UNDER THE SWAY OF A MOBILE DEVICE DURING AN IN-STORE SHOPPING EXPERIENCE,YES,On Google Drive Folder
94,94 - THE MEDIATING EFFECT OF CONSUMER EMPOWERMENT IN OMNI-CHANNEL RETAILING.pdf,THE MEDIATING EFFECT OF CONSUMER EMPOWERMENT IN OMNI-CHANNEL RETAILING,YES,On Google Drive Folder
95,95 - OMNICHANNEL RETAILING STRATEGY A SYSTEMATIC REVIEW.pdf,OMNICHANNEL RETAILING STRATEGY: A SYSTEMATIC REVIEW,YES,On Google Drive Folder
96,96 - OPTIMIZING OMNI-CHANNEL FULFILLMENT WITH STORE TRANSFERS.pdf,OPTIMIZING OMNI-CHANNEL FULFILLMENT WITH STORE TRANSFERS,YES,On Google Drive Folder
97,97 - OMNI CHANNEL SHOPPING RETAILING AND SOCIAL PHASE OF CONSUMER BEHAVIOR.pdf,OMNI CHANNEL SHOPPING RETAILING AND SOCIAL PHASE OF CONSUMER BEHAVIOR,YES,On Google Drive Folder
98,98 - A CONFIGURATIONAL APPROACH TO LAST MILE LOGISTICS PRACTICES.pdf,A CONFIGURATIONAL APPROACH TO LAST MILE LOGISTICS PRACTICES AND OMNI-CHANNEL FIRM CHARACTERISTICS FOR COMPETITIVE ADVANTAGE: A FUZZY-SET QUALITATIVE COMPARATIVE ANALYSIS,YES,On Google Drive Folder
99,99 - A SHARING-ENABLED PORTFOLIO APPROACH TO DISTRIBUTION.pdf,A SHARING-ENABLED PORTFOLIO APPROACH TO DISTRIBUTION,YES,On Google Drive Folder
100,100 - CHALLENGES AT THE MARKETING-OPERATIONS INTERFACE IN OMNI-CHANNEL RETAIL ENVIRONMENTS.pdf,CHALLENGES AT THE MARKETING-OPERATIONS INTERFACE IN OMNI-CHANNEL RETAIL ENVIRONMENTS,YES,On Google Drive Folder
101,101 - SMART LUXURY SHOPPERS BEHAVIOUR IN CHINA.pdf,SMART LUXURY SHOPPERS' BEHAVIOUR IN CHINA: OMNI-CHANNEL PERSPECTIVES OF GEN Y CONSUMERS,YES,On Google Drive Folder
102,,A NOVEL ALGORITHM FOR EVALUATING THE CONFIGURATIONS OF OMNI-CHANNEL DISTRIBUTION NETWORK CONSIDERING TRANSPARENCY AND CONSENSUS FORMATION,NO,Cancelled by ILL Staff
103,103 - INVENTORY STRATEGY OF FRESH PRODUCTS FOR OMNI-CHANNEL SUPPLY CHAINS.pdf,INVENTORY STRATEGY OF FRESH PRODUCTS FOR OMNI-CHANNEL SUPPLY CHAINS,YES,On Google Drive Folder
104,104 - A BIBLIOMETRIC REVIEW OF THE OMNICHANNEL LOGISTICS LITERATURE.pdf,A BIBLIOMETRIC REVIEW OF THE OMNICHANNEL LOGISTICS LITERATURE,YES,On Google Drive Folder
105,105 - REPLENISHMENT AND FULFILMENT DECISIONS FOR STORES IN AN OMNI-CHANNEL RETAIL NETWORK.pdf,REPLENISHMENT AND FULFILMENT DECISIONS FOR STORES IN AN OMNI-CHANNEL RETAIL NETWORK,YES,On Google Drive Folder
106,106 - BLURRING THE LINES BETWEEN PHYSICAL AND DIGITAL SPACES.pdf,BLURRING THE LINES BETWEEN PHYSICAL AND DIGITAL SPACES: BUSINESS MODEL INNOVATION IN RETAILING,YES,On Google Drive Folder
107,"107 - EXPLORING TRENDS, IMPLICATIONS AND CHALLENGES FOR LOGISTICS INFORMATION SYSTEMS IN OMNI-CHANNELS.pdf","EXPLORING TRENDS, IMPLICATIONS AND CHALLENGES FOR LOGISTICS INFORMATION SYSTEMS IN OMNI-CHANNELS: SWEDISH RETAILERS' PERCEPTION",YES,On Google Drive Folder
108,108 - WHY DOES OMNI-CHANNEL ALLOW RETAILERS TO FOSTER SUPPLY CHAIN RESILIENCE EVIDENCE FROM SEQUENTIAL MIXED METHODS RESEARCH.pdf,WHY DOES OMNI-CHANNEL ALLOW RETAILERS TO FOSTER SUPPLY CHAIN RESILIENCE? EVIDENCE FROM SEQUENTIAL MIXED METHODS RESEARCH,YES,On Google Drive Folder
109,109 - SELF-SELECTION AND PURCHASE VALUE OF RESEARCH SHOPPERS.pdf,SELF-SELECTION AND PURCHASE VALUE OF RESEARCH SHOPPERS,YES,On Google Drive Folder
110,"110 - DESIGNING MULTI-TIER, MULTI-SERVICE-LEVEL, AND MULTI-MODAL LAST-MILE DISTRIBUTION NETWORKS FOR OMNI-CHANNEL OPERATIONS.pdf","DESIGNING MULTI-TIER, MULTI-SERVICE-LEVEL, AND MULTI-MODAL LAST-MILE DISTRIBUTION NETWORKS FOR OMNI-CHANNEL OPERATIONS",YES,On Google Drive Folder
111,111 - AN INVESTIGATION ON CONSUMERS_ PREFERENCES FOR PARCEL DELIVERIES APPLYING CONSUMER LOGISTICS IN OMNI-CHANNEL SHOPPING.pdf,AN INVESTIGATION ON CONSUMERS' PREFERENCES FOR PARCEL DELIVERIES: APPLYING CONSUMER LOGISTICS IN OMNI-CHANNEL SHOPPING,YES,On Google Drive Folder
112,112 - CHANNEL COMPETITION IN OMNI-CHANNEL SUPPLY CHAIN CONSIDERING SOCIAL MEDIA ADVERTISING.pdf,CHANNEL COMPETITION IN OMNI-CHANNEL SUPPLY CHAIN CONSIDERING SOCIAL MEDIA ADVERTISING,YES,On Google Drive Folder
113,113 - MICRO-LEVEL PRACTICES OF BRICOLAGE DURING BUSINESS MODEL INNOVATION PROCESS THE CASE OF DIGITAL TRANSFORMATION.pdf,MICRO-LEVEL PRACTICES OF BRICOLAGE DURING BUSINESS MODEL INNOVATION PROCESS: THE CASE OF DIGITAL TRANSFORMATION TOWARDS OMNI-CHANNEL RETAILING,YES,On Google Drive Folder
114,114 - OPTIMAL PRICING DECISIONS FOR AN OMNI-CHANNEL SUPPLY CHAIN WITH RETAIL SERVICE.pdf,OPTIMAL PRICING DECISIONS FOR AN OMNI-CHANNEL SUPPLY CHAIN WITH RETAIL SERVICE,YES,On Google Drive Folder
115,115 - HOW WEBSITE BROWSING IMPACTS EXPECTATIONS OF STORE FEATURES.pdf,HOW WEBSITE BROWSING IMPACTS EXPECTATIONS OF STORE FEATURES,YES,On Google Drive Folder
116,116 - ANTECEDENTS AND CONSEQUENCES OF CROSS-EFFECTS AN EMPIRICAL ANALYSIS OF OMNI-COUPONS.pdf,ANTECEDENTS AND CONSEQUENCES OF CROSS-EFFECTS: AN EMPIRICAL ANALYSIS OF OMNI-COUPONS,YES,On Google Drive Folder
117,117 - CONSUMER LOGISTICS IN CONTEMPORARY SHOPPING A SYNTHESISED REVIEW.pdf,CONSUMER LOGISTICS IN CONTEMPORARY SHOPPING: A SYNTHESISED REVIEW,YES,On Google Drive Folder
118,118 - SHOPPING IN THE OMNICHANNEL SUPPLY CHAIN UNDER PRICE COMPETITION AND PRODUCT RETURN.pdf,SHOPPING IN THE OMNICHANNEL SUPPLY CHAIN UNDER PRICE COMPETITION AND PRODUCT RETURN,YES,On Google Drive Folder
119,119 - HOW TO MEASURE OMNICHANNEL MARKETING INDICATOR-BASED APPROACH.pdf,HOW TO MEASURE OMNICHANNEL? MARKETING INDICATOR-BASED APPROACH - THEORY FUNDAMENTALS,YES,On Google Drive Folder
120,120 - SHARED CAPACITY ROUTING PROBLEM - AN OMNI-CHANNEL RETAIL STUDY.pdf,SHARED CAPACITY ROUTING PROBLEM - AN OMNI-CHANNEL RETAIL STUDY,YES,On Google Drive Folder
121,121 - ADOPTION BARRIERS IN ENGAGING YOUNG CONSUMERS IN THE OMNI-CHANNEL RETAILING.pdf,ADOPTION BARRIERS IN ENGAGING YOUNG CONSUMERS IN THE OMNI-CHANNEL RETAILING,YES,On Google Drive Folder
122,122 - OMNICHANNEL PROMOTIONS AND THEIR EFFECT ON CUSTOMER SATISFACTION.pdf,OMNICHANNEL PROMOTIONS AND THEIR EFFECT ON CUSTOMER SATISFACTION,YES,On Google Drive Folder
123,123 - EXAMINING THE ANATOMY OF LAST-MILE DISTRIBUTION IN E-COMMERCE OMNICHANNEL RETAILING.pdf,EXAMINING THE ANATOMY OF LAST-MILE DISTRIBUTION IN E-COMMERCE OMNICHANNEL RETAILING: A SUPPLY NETWORK CONFIGURATION APPROACH,YES,On Google Drive Folder
124,124 - NOT ALL ADAPTIVE SELLING TO OMNI-CONSUMERS IS INFLUENTIAL THE MODERATING EFFECT OF PRODUCT TYPE.pdf,NOT ALL ADAPTIVE SELLING TO OMNI-CONSUMERS IS INFLUENTIAL: THE MODERATING EFFECT OF PRODUCT TYPE,YES,On Google Drive Folder
125,125 - CROSS-CHANNEL INTEGRATION AND CUSTOMER EXPERIENCE IN OMNI CHANNEL RETAIL SERVICES.pdf,CROSS-CHANNEL INTEGRATION AND CUSTOMER EXPERIENCE IN OMNI CHANNEL RETAIL SERVICES,YES,On Google Drive Folder
126,126 - CONFIGURING RETAIL FULFILLMENT PROCESSES FOR OMNI-CHANNEL CUSTOMER STEERING.pdf,CONFIGURING RETAIL FULFILLMENT PROCESSES FOR OMNI-CHANNEL CUSTOMER STEERING,YES,On Google Drive Folder
127,127 - SUPPLY CHAIN INTEGRATION IN OMNI-CHANNEL RETAILING.pdf,SUPPLY CHAIN INTEGRATION IN OMNI-CHANNEL RETAILING: A LOGISTICS PERSPECTIVE,YES,On Google Drive Folder
128,128 - COMPETITIVE SUSTAINABLE PROCESSES AND PRICING DECISIONS IN OMNICHANNEL CLOSED-UP SUPPLY CHAINS UNDER DIFFERENT CHANNEL POWER STRUCTURES.pdf,COMPETITIVE SUSTAINABLE PROCESSES AND PRICING DECISIONS IN OMNICHANNEL CLOSED-UP SUPPLY CHAINS UNDER DIFFERENT CHANNEL POWER STRUCTURES,YES,On Google Drive Folder
129,129 - FLATLINED COMBATTING THE DEATH OF RETAIL CHECK FOR UPDATES STORES.pdf,FLATLINED: COMBATTING THE DEATH OF RETAIL CHECK FOR UPDATES STORES,YES,On Google Drive Folder
130,130 - AN INVESTIGATION OF WHAT FACTORS DETERMINE THE WAY IN WHICH CUSTOMER SATISFACTION.pdf,AN INVESTIGATION OF WHAT FACTORS DETERMINE THE WAY IN WHICH CUSTOMER SATISFACTION IS INCREASED THROUGH OMNI-CHANNEL MARKETING IN RETAIL,YES,On Google Drive Folder
131,131 - CONSUMER DECISION-MAKING IN OMNICHANNEL RETAILING.pdf,CONSUMER DECISION-MAKING IN OMNICHANNEL RETAILING: LITERATURE REVIEW AND FUTURE RESEARCH AGENDA,YES,On Google Drive Folder
