item,filename,article_title,in_folder,notes
132,132 - ORDER FULFILLMENT POLICIES FOR SHIP-FROM-STORE IMPLEMENTATION IN OMNI-CHANNEL RETAILING.pdf,ORDER FULFILLMENT POLICIES FOR SHIP-FROM-STORE IMPLEMENTATION IN OMNI-CHANNEL RETAILING,YES,Requested again
133,133 - EXAMINING RETAIL BUSINESS MODEL TRANSFORMATION.pdf,EXAMINING RETAIL BUSINESS MODEL TRANSFORMATION: A LONGITUDINAL STUDY OF THE TRANSITION TO OMNICHANNEL ORDER FULFILLMENT,YES,On Google Drive Folder
134,134 - SUPPLY CHAIN INTEGRATION IN OMNI-CHANNEL RETAILING.pdf,SUPPLY CHAIN INTEGRATION IN OMNI-CHANNEL RETAILING: A HUMAN RESOURCE MANAGEMENT PERSPECTIVE,YES,On Google Drive Folder
135,135 - BI-OBJECTIVE OPTIMIZATION FOR SUSTAINABLE SUPPLY CHAIN NETWORK DESIGN IN OMNICHANNEL.pdf,BI-OBJECTIVE OPTIMIZATION FOR SUSTAINABLE SUPPLY CHAIN NETWORK DESIGN IN OMNICHANNEL,YES,On Google Drive Folder
136,136 - WHY RETAIL FIRMS COMMONLY GET ONLY HALFWAY THROUGH CHANNEL INTEGRATION WITH ONLINE CHANNELS.pdf,WHY RETAIL FIRMS COMMONLY GET ONLY HALFWAY THROUGH CHANNEL INTEGRATION WITH ONLINE CHANNELS,YES,On Google Drive Folder
137,137 - MODELLING THE INFLUENCE OF RETURNS FOR AN OMNI-CHANNEL RETAILER.pdf,MODELLING THE INFLUENCE OF RETURNS FOR AN OMNI-CHANNEL RETAILER,YES,On Google Drive Folder
138,138 - BUSINESS LOGISTICS MODELS IN OMNI-CHANNEL.pdf,BUSINESS LOGISTICS MODELS IN OMNI-CHANNEL: A CLASSIFICATION FRAMEWORK AND EMPIRICAL ANALYSIS,YES,On Google Drive Folder
139,139 - OMNI-CHANNEL RETAILING ON PLATFORMS.pdf,OMNI-CHANNEL RETAILING ON PLATFORMS: DISENTANGLING THE EFFECTS OF CHANNEL INTEGRATION AND INTER-PLATFORM FUNCTION USAGE DIFFERENCE,YES,On Google Drive Folder
140,140 - FROM E RETAIL TO OMNI CHANNEL RETAIL A STRATEGIC INITIATIVE OF A FASHION ETAILER.pdf,"FROM ""E"" RETAIL TO ""OMNI"" CHANNEL RETAIL: A STRATEGIC INITIATIVE OF A FASHION ETAILER",YES,On Google Drive Folder
141,141 - THE PARADOX OF DIMINISHING RETURNS MEASUREMENT AND METRICS FOR VALUATION OF B2C SALES PROFESSIONALS.pdf,THE PARADOX OF DIMINISHING RETURNS: MEASUREMENT AND METRICS FOR VALUATION OF B2C SALES PROFESSIONALS,YES,On Google Drive Folder
142,142 - AN ANALYTICAL ASSESSMENT OF DEMAND EFFECTS IN OMNI-CHANNEL ASSORTMENT PLANNING.pdf,AN ANALYTICAL ASSESSMENT OF DEMAND EFFECTS IN OMNI-CHANNEL ASSORTMENT PLANNING,YES,On Google Drive Folder
143,143 - OMNI-CHANNEL RETAILING IN SUPPLY CHAINS.pdf,OMNI-CHANNEL RETAILING IN SUPPLY CHAINS: A SYSTEMATIC LITERATURE REVIEW,YES,On Google Drive Folder
144,144 - FACTORS AFFECTING OMNICHANNEL BUYING ONLINE AND RETURN IN STORE EVIDENCE FROM FAST-FASHION RETAIL.pdf,FACTORS AFFECTING OMNICHANNEL BUYING ONLINE AND RETURN IN STORE: EVIDENCE FROM FAST-FASHION RETAIL,YES,On Google Drive Folder
145,145 - IMPORTANCE OF OFFLINE SERVICE QUALITY IN BUILDING LOYALTY OF OC SERVICE BRAND.pdf,IMPORTANCE OF OFFLINE SERVICE QUALITY IN BUILDING LOYALTY OF OC SERVICE BRAND,YES,On Google Drive Folder
146,146 - LAST MILE FULFILMENT AND DISTRIBUTION IN OMNI-CHANNEL GROCERY RETAILING.pdf,LAST MILE FULFILMENT AND DISTRIBUTION IN OMNI-CHANNEL GROCERY RETAILING A STRATEGIC PLANNING FRAMEWORK,YES,On Google Drive Folder
147,147 - E-FULFILMENT AND DISTRIBUTION IN OMNI-CHANNEL RETAILING.pdf,E-FULFILMENT AND DISTRIBUTION IN OMNI-CHANNEL RETAILING: A SYSTEMATIC LITERATURE REVIEW,YES,On Google Drive Folder
148,148 - IMPACT OF BUNDLING ON THE OMNICHANNEL SUPPLY CHAIN UNDER PRICE COMPETITION.pdf,IMPACT OF BUNDLING ON THE OMNICHANNEL SUPPLY CHAIN UNDER PRICE COMPETITION,YES,On Google Drive Folder
149,149 - EFFECT OF SERVICE FACTORS AND BUY-ONLINE-PICK-UP-IN-STORE STRATEGIES THROUGH AN OMNICHANNEL SYSTEM.pdf,EFFECT OF SERVICE FACTORS AND BUY-ONLINE-PICK-UP-IN-STORE STRATEGIES THROUGH AN OMNICHANNEL SYSTEM UNDER AN AGRICULTURAL SUPPLY CHAIN MANAGEMENT,YES,On Google Drive Folder
150,150 - BIOBJECTIVE OPTIMIZATION MODEL FOR STORE SELECTION.pdf,BIOBJECTIVE OPTIMIZATION MODEL FOR STORE SELECTION FOR BOPS SERVICE IN OMNI-CHANNEL RETAIL CHAIN,YES,On Google Drive Folder
151,151 - IN-STORE SHOPPING WITH LOCATION-BASED RETAIL APPS.pdf,"IN-STORE SHOPPING WITH LOCATION-BASED RETAIL APPS: PERCEIVED VALUE, CONSUMER RESPONSE, AND THE MODERATING EFFECT OF FLOW",YES,On Google Drive Folder
152,152 - From bricks-and-mortar to bricks-and-clicks Logistics networks in omni-channel grocery retailing.pdf,FROM BRICKS-AND-MORTAR TO BRICKS-AND-CLICKS: LOGISTICS NETWORKS IN OMNI-CHANNEL GROCERY RETAILING,YES,On Google Drive Folder
153,153 - RETAIL LOGISTICS IN THE TRANSITION FROM MULTI-CHANNEL TO OMNI-CHANNEL.pdf,RETAIL LOGISTICS IN THE TRANSITION FROM MULTI-CHANNEL TO OMNI-CHANNEL,YES,On Google Drive Folder
154,154 - ANALYSIS OF IMPLEMENTATION BARRIERS TO LOGISTICS SYSTEMS INTEGRATION FOR OMNI-CHANNEL RETAILING.pdf,ANALYSIS OF IMPLEMENTATION BARRIERS TO LOGISTICS SYSTEMS INTEGRATION FOR OMNI-CHANNEL RETAILING USING AN INTEGRATED ISM-FUZZY MICMAC APPROACH,YES,On Google Drive Folder
155,155 - PREVENTING RETURN FRAUD IN REVERSE LOGISTICS-A CASE STUDY OF ESPRES SOLUTION BY ETHEREUM.pdf,PREVENTING RETURN FRAUD IN REVERSE LOGISTICS-A CASE STUDY OF ESPRES SOLUTION BY ETHEREUM,YES,On Google Drive Folder
156,156 - RETAINING CUSTOMERS WITH IN-STORE MOBILE USAGE EXPERIENCE IN OMNI-CHANNEL RETAILING THE MODERATING EFFECTS OF PRODUCT INFORMATION.pdf,RETAINING CUSTOMERS WITH IN-STORE MOBILE USAGE EXPERIENCE IN OMNI-CHANNEL RETAILING: THE MODERATING EFFECTS OF PRODUCT INFORMATION OVERLOAD AND ALTERNATIVE ATTRACTIVENESS,YES,On Google Drive Folder
157,157 - EXAMINING THE VALUE OF FLEXIBLE LOGISTICS OFFERINGS.pdf,EXAMINING THE VALUE OF FLEXIBLE LOGISTICS OFFERINGS,YES,On Google Drive Folder
158,"158 - FOR SHOWING ONLY, OR FOR SELLING THE OPTIMAL PHYSICAL STORE MODE SELECTION DECISION FOR E-TAILERS UNDER COMPETITION.pdf",CONSUMER PSEUDO-SHOWROOMING AND OMNI-CHANNEL PLACEMENT STRATEGIES,YES,On Google Drive Folder
159,159 - MULTI-CHANNEL AND OMNI-CHANNEL RETAILING IN THE SCIENTIFIC LITERATURE A TEXT MINING APPROACH.pdf,"FOR SHOWING ONLY, OR FOR SELLING? THE OPTIMAL PHYSICAL STORE MODE SELECTION DECISION FOR E-TAILERS UNDER COMPETITION",YES,On Google Drive Folder
160,160 - IDENTIFYING CONSUMER_S LAST-MILE LOGISTICS BELIEFS IN OMNI-CHANNEL ENVIRONMENT.pdf,MULTI-CHANNEL AND OMNI-CHANNEL RETAILING IN THE SCIENTIFIC LITERATURE: A TEXT MINING APPROACH,YES,On Google Drive Folder
161,"161 - HIGHER EDUCATION_S ROLE IN CAPACITATING RETAIL BUSINESSES_ WELL-BEING, RESILIENCE AND EFFICIENCY POST-COVID-19.pdf",IDENTIFYING CONSUMER'S LAST-MILE LOGISTICS BELIEFS IN OMNI-CHANNEL ENVIRONMENT,YES,On Google Drive Folder
162,162 - SHIPPING CONSOLIDATION ACROSS TWO WAREHOUSES WITH DELIVERY DEADLINE AND EXPEDITED OPTIONS FOR E-COMMERCE AND OMNI-CHANNEL RETAILERS.pdf,"HIGHER EDUCATION'S ROLE IN CAPACITATING RETAIL BUSINESSES' WELL-BEING, RESILIENCE AND EFFICIENCY POST-COVID-19",YES,On Google Drive Folder
163,163 - SHOPPING APP FEATURES INFLUENCING THE DOWNLOAD AND USE INTENTION.pdf,SHIPPING CONSOLIDATION ACROSS TWO WAREHOUSES WITH DELIVERY DEADLINE AND EXPEDITED OPTIONS FOR E-COMMERCE AND OMNI-CHANNEL RETAILERS,YES,On Google Drive Folder
164,164 - A multicommodity pickup and delivery problem with time windows and handling time.pdf,SHOPPING APP FEATURES: INFLUENCING THE DOWNLOAD AND USE INTENTION,YES,On Google Drive Folder
165,,A MULTICOMMODITY PICKUP AND DELIVERY PROBLEM WITH TIME WINDOWS AND HANDLING TIME IN THE OMNI-CHANNEL LAST-MILE DELIVERY,NO,On Google Drive Folder
166,166 - THE IMPACT OF DIGITAL INNOVATIONS ON MARKETING AND CONSUMERS.pdf,THE IMPACT OF DIGITAL INNOVATIONS ON MARKETING AND CONSUMERS,YES,On Google Drive Folder
167,167 - MOBILE PAYMENT AND ONLINE TO OFFLINE RETAIL BUSINESS MODELS.pdf,MOBILE PAYMENT AND ONLINE TO OFFLINE RETAIL BUSINESS MODELS,YES,On Google Drive Folder
168,168 - VINTAGE FASHION RETAILING BUILDING THE STORE BRAND.pdf,MOBILE PAYMENT AND ONLINE TO OFFLINE RETAIL BUSINESS MODELS,YES,Duplicate of 167
169,,VINTAGE FASHION RETAILING: BUILDING THE STORE BRAND,NO,On Google Drive Folder
170,170 - BUY-ONLINE-AND-DELIVER-FROM-STORE STRATEGY FOR A DUAL-CHANNEL SUPPLY CHAIN CONSIDERING RETAILER_S LOCATION ADVANTAGE.pdf,BUY-ONLINE-AND-DELIVER-FROM-STORE STRATEGY FOR A DUAL-CHANNEL SUPPLY CHAIN CONSIDERING RETAILER'S LOCATION ADVANTAGE,YES,On Google Drive Folder
171,171 - PIONEERING STRATEGIES IN RETAIL SETTINGS AN EMPIRICAL STUDY OF SUCCESSFUL PRACTICES.pdf,BALANCE CUES OF ONLINE-OFFLINE CHANNEL INTEGRATION: CONSIDERING THE MODERATING ROLE OF CUSTOMER'S SHOWROOMING MOTIVATION,YES,Requested again
172,,PIONEERING STRATEGIES IN RETAIL SETTINGS: AN EMPIRICAL STUDY OF SUCCESSFUL PRACTICES,NO,On Google Drive Folder
173,173 - THE EFFECT OF CROSS-CHANNEL INTEGRATION ON COST EFFICIENCY.pdf,"PRIMAL-DUAL ALGORITHMS FOR ORDER FULFILLMENT AT URBAN OUTFITTERS, INC.",YES,On Google Drive Folder
174,,THE EFFECT OF CROSS-CHANNEL INTEGRATION ON COST EFFICIENCY,NO,On Google Drive Folder
175,175 - IS SHOWROOMING REALLY SO TERRIBLE START UNDERSTANDING SHOWROOMERS.pdf,IS SHOWROOMING REALLY SO TERRIBLE? START UNDERSTANDING SHOWROOMERS,YES,On Google Drive Folder
176,176 - ENEMIES TO FRENEMIES COOPETITION BETWEEN ONLINE AND OFFLINE RETAILERS AMIDST CRISES.pdf,ENEMIES TO FRENEMIES: COOPETITION BETWEEN ONLINE AND OFFLINE RETAILERS AMIDST CRISES,YES,On Google Drive Folder
177,177 - PRACTICE BRIEFING THE FUTURE OF THE UK TURNOVER-BASED LEASE IN THE WORLD OF OMNI-CHANNEL RETAIL.pdf,PRACTICE BRIEFING: THE FUTURE OF THE UK TURNOVER-BASED LEASE IN THE WORLD OF OMNI-CHANNEL RETAIL,YES,On Google Drive Folder
178,178 - EVALUATION OF ORDER FULFILLMENT OPTIONS IN RETAIL SUPPLY CHAINS.pdf,THE MULTI-CHANNEL IMPACT ON THE SALES FORCES MANAGEMENT,YES,On Google Drive Folder
179,179 - SUSTAINABLE REVERSE SUPPLY CHAINS FOR RETAIL PRODUCT RETURNS.pdf,EVALUATION OF ORDER FULFILLMENT OPTIONS IN RETAIL SUPPLY CHAINS,YES,On Google Drive Folder
180,180 - WHO ARE THE MULTICHANNEL SHOPPERS AND HOW CAN RETAILERS USE THEM EVIDENCE FROM THE FRENCH APPAREL INDUSTRY.pdf,SUSTAINABLE REVERSE SUPPLY CHAINS FOR RETAIL PRODUCT RETURNS,YES,On Google Drive Folder
181,181 - VIABILITY OF AMAZON_S DRIVEN INNOVATIONS TARGETING SHOPPERS_ IMPULSIVENESS.pdf,WHO ARE THE MULTICHANNEL SHOPPERS AND HOW CAN RETAILERS USE THEM? EVIDENCE FROM THE FRENCH APPAREL INDUSTRY,YES,On Google Drive Folder
182,,VIABILITY OF AMAZON'S DRIVEN INNOVATIONS TARGETING SHOPPERS' IMPULSIVENESS,NO,On Google Drive Folder
183,183 - EXPLORING AN IN-STORE CUSTOMER JOURNEY FOR CUSTOMERS SHOPPING FOR OUTDOOR APPAREL.pdf,EXPLORING AN IN-STORE CUSTOMER JOURNEY FOR CUSTOMERS SHOPPING FOR OUTDOOR APPAREL,YES,On Google Drive Folder
184,184 - THE END OF THE WORLD AS WE KNOW IT THE INFLUENCE OF ONLINE CHANNELS ON THE LUXURY CUSTOMER EXPERIENCE.pdf,THE END OF THE WORLD AS WE KNOW IT? THE INFLUENCE OF ONLINE CHANNELS ON THE LUXURY CUSTOMER EXPERIENCE,YES,On Google Drive Folder
185,,COMPARISON OF CONSUMERS' ACCEPTANCE OF ONLINE APPAREL MASS CUSTOMIZATION ACROSS WEB AND MOBILE CHANNELS,NO,On Google Drive Folder
186,186 - AGILE ORGANIZATIONAL CONCEPTS FOR RETAIL COMPANIES IN TIMES OF DIGITALIZATION DESIGN AND MANAGEMENT OF AGILE.pdf,AGILE ORGANIZATIONAL CONCEPTS FOR RETAIL COMPANIES IN TIMES OF DIGITALIZATION: DESIGN AND MANAGEMENT OF AGILE ORGANIZATIONAL STRUCTURES FOR MORE COMPETITIVENESS IN THE FACE OF CHANGING CUSTOMER NEEDS,YES,On Google Drive Folder
187,187 - DETERMINANTS OF RETAILERS_ CROSS-CHANNEL INTEGRATION AN INNOVATION DIFFUSION PERSPECTIVE ON OMNI-CHANNEL RETAILING.pdf,"RECIPROCITY WITHIN MAJOR RETAIL PURCHASE CHANNELS AND THEIR EFFECTS ON OVERALL, OFFLINE AND ONLINE LOYALTY",YES,On Google Drive Folder
188,188 - LOOK BEFORE YOU LEAP ECONOMICS OF BEING AN OMNICHANNEL RETAILER.pdf,DETERMINANTS OF RETAILERS' CROSS-CHANNEL INTEGRATION: AN INNOVATION DIFFUSION PERSPECTIVE ON OMNI-CHANNEL RETAILING,YES,On Google Drive Folder
189,,LOOK BEFORE YOU LEAP: ECONOMICS OF BEING AN OMNICHANNEL RETAILER,NO,On Google Drive Folder
190,"190 - WHAT DRIVES CUSTOMER ENGAGEMENT IN OMNICHANNEL RETAILING THE ROLE OF OMNICHANNEL INTEGRATION, PERCEIVED FLUENCY, AND PERCEIVED FLOW.pdf",DISCOURAGE OR ENCOURAGE? AN ONLINE MANUFACTURE'S RESPONSE TO COMPETING PRODUCT INTRODUCTION UNDER PHYSICAL SHOWROOM COOPERATION,YES,On Google Drive Folder
191,191 - EMPOWERING RETAILERS A BOUNDED RATIONALITY PERSPECTIVE TO ENHANCING OMNICHANNEL JOURNEY SATISFACTION.pdf,"WHAT DRIVES CUSTOMER ENGAGEMENT IN OMNICHANNEL RETAILING? THE ROLE OF OMNICHANNEL INTEGRATION, PERCEIVED FLUENCY, AND PERCEIVED FLOW",YES,On Google Drive Folder
192,192 - EFFECTIVENESS OF INTEGRATED OFFLINE-AND-ONLINE PROMOTIONS IN OMNICHANNEL TARGETING A RANDOMIZED FIELD EXPERIMENT.pdf,EMPOWERING RETAILERS: A BOUNDED RATIONALITY PERSPECTIVE TO ENHANCING OMNICHANNEL JOURNEY SATISFACTION,YES,On Google Drive Folder
193,193 - PLANNING AND IMPLEMENTING AN EFFECTIVE OMNICHANNEL MARKETING PROGRAM.pdf,EFFECTIVENESS OF INTEGRATED OFFLINE-AND-ONLINE PROMOTIONS IN OMNICHANNEL TARGETING: A RANDOMIZED FIELD EXPERIMENT,YES,On Google Drive Folder
194,194 - IS THE SHOPPER ALWAYS THE KING QUEEN STUDY OF OMNICHANNEL RETAIL TECHNOLOGY USE AND SHOPPING ORIENTATIONS.pdf,PLANNING AND IMPLEMENTING AN EFFECTIVE OMNICHANNEL MARKETING PROGRAM,YES,On Google Drive Folder
195,,IS THE SHOPPER ALWAYS THE KING/QUEEN? STUDY OF OMNICHANNEL RETAIL TECHNOLOGY USE AND SHOPPING ORIENTATIONS,NO,On Google Drive Folder
196,,BUY ONLINE AND PICK UP IN-STORE: DESIGN OF THE SERVICE AREA,NO,Requested again
197,197 - REDUCING COMPETITIVE RESEARCH SHOPPING WITH CROSS-CHANNEL DELIVERY.pdf,INFLUENCES OF OMNICHANNEL INTEGRATION AND VALUE CONGRUENCE ON CUSTOMER PATRONAGE: THE FLOW THEORY PERSPECTIVE,YES,On Google Drive Folder
198,,REDUCING COMPETITIVE RESEARCH SHOPPING WITH CROSS-CHANNEL DELIVERY,NO,On Google Drive Folder
199,199 - LEARNING TO BE CONSUMERS OF SMART RETAIL CHANNELS THE BABY BOOMER EXPERIENCE.pdf,"LEARNING TO BE CONSUMERS OF ""SMART"" RETAIL CHANNELS: THE BABY BOOMER EXPERIENCE",YES,On Google Drive Folder
200,200 - THE EFFECTS OF UTILITARIAN VALUE ON OMNICHANNEL CONTINUANCE INTENTION THE MODERATING ROLE OF PRODUCT INVOLVEMENT.pdf,TRACING THE EVOLUTION & PROJECTING THE FUTURE OF IN-STORE MARKETING,YES,Cancelled by ILL Staff
201,201 - INFORMATION EFFECTS OF WAREHOUSE AUTOMATION ON SALES IN OMNICHANNEL RETAILING.pdf,THE EFFECTS OF UTILITARIAN VALUE ON OMNICHANNEL CONTINUANCE INTENTION: THE MODERATING ROLE OF PRODUCT INVOLVEMENT,YES,On Google Drive Folder
202,202 - DYNAMIC CAPABILITIES IN THE REALISATION OF OMNICHANNEL RETAILING.pdf,INFORMATION EFFECTS OF WAREHOUSE AUTOMATION ON SALES IN OMNICHANNEL RETAILING,YES,On Google Drive Folder
203,203 - THE TRANSFORMATIVE AND EVOLUTIONARY APPROACH OF OMNICHANNEL IN RETAIL COMPANIES INSIGHTS FROM MULTI-CASE STUDIES IN PORTUGAL.pdf,DYNAMIC CAPABILITIES IN THE REALISATION OF OMNICHANNEL RETAILING,YES,On Google Drive Folder
204,204 - WHAT KIND OF IN-STORE SMART RETAILING FOR AN OMNICHANNEL REAL-LIFE EXPERIENCE.pdf,THE TRANSFORMATIVE AND EVOLUTIONARY APPROACH OF OMNICHANNEL IN RETAIL COMPANIES: INSIGHTS FROM MULTI-CASE STUDIES IN PORTUGAL,YES,On Google Drive Folder
205,205 - AN OMNICHANNEL APPROACH TO RETAILING DEMYSTIFYING AND IDENTIFYING THE FACTORS INFLUENCING AN OMNICHANNEL EXPERIENCE.pdf,WHAT KIND OF IN-STORE SMART RETAILING FOR AN OMNICHANNEL REAL-LIFE EXPERIENCE?,YES,On Google Drive Folder
206,206 - INFLUENCE OF PERCEIVED VALUE ON OMNICHANNEL USAGE MEDIATING AND MODERATING ROLES OF THE OMNICHANNEL SHOPPING HABIT.pdf,AN OMNICHANNEL APPROACH TO RETAILING: DEMYSTIFYING AND IDENTIFYING THE FACTORS INFLUENCING AN OMNICHANNEL EXPERIENCE,YES,On Google Drive Folder
207,,INFLUENCE OF PERCEIVED VALUE ON OMNICHANNEL USAGE: MEDIATING AND MODERATING ROLES OF THE OMNICHANNEL SHOPPING HABIT,NO,On Google Drive Folder
208,208 - HOW CUSTOMER EXPERIENCE INCONGRUENCE AFFECTS OMNICHANNEL CUSTOMER RETENTION THE MODERATING ROLE OF CHANNEL CHARACTERISTICS.pdf,HOW CUSTOMER EXPERIENCE INCONGRUENCE AFFECTS OMNICHANNEL CUSTOMER RETENTION: THE MODERATING ROLE OF CHANNEL CHARACTERISTICS,YES,On Google Drive Folder
209,209 - OMNICHANNEL FULFILLMENT STRATEGIES DEFINING THE CONCEPT AND BUILDING AN AGENDA FOR FUTURE INQUIRY.pdf,THE IMPACT OF TRUST ON PURCHASE INTENTION THROUGH OMNICHANNEL RETAILING,YES,On Google Drive Folder
210,,OMNICHANNEL FULFILLMENT STRATEGIES: DEFINING THE CONCEPT AND BUILDING AN AGENDA FOR FUTURE INQUIRY,NO,On Google Drive Folder
211,211 - ENGAGING WITH OMNICHANNEL BRANDS THE ROLE OF CONSUMER EMPOWERMENT.pdf,OMNICHANNEL AND CONSUMER AND RETAILER PERCEIVED RISKS AND BENEFITS: A REVIEW,YES,On Google Drive Folder
212,212 - OMNICHANNEL QUALITY THE NEW IMPERATIVE OF PURCHASE INTENTION AMONG FASHION RETAIL MARKET.pdf,ENGAGING WITH OMNICHANNEL BRANDS: THE ROLE OF CONSUMER EMPOWERMENT,YES,On Google Drive Folder
213,,OMNICHANNEL QUALITY: THE NEW IMPERATIVE OF PURCHASE INTENTION AMONG FASHION RETAIL MARKET,NO,On Google Drive Folder
214,214 - OMNICHANNEL RETAIL OPERATIONS WITH CONSUMER RETURNS AND ORDER CANCELLATION.pdf,OMNICHANNEL RETAIL OPERATIONS WITH CONSUMER RETURNS AND ORDER CANCELLATION,YES,On Google Drive Folder
215,215 - EFFECTS OF INCREASED OMNICHANNEL INTEGRATION ON CUSTOMER SATISFACTION AND LOYALTY INTENTIONS.pdf,DESIGNING MULTI-CHANNEL TECHNOLOGIES ? THE MEDIATING ROLE OF RISK PERCEPTIONS,YES,On Google Drive Folder
216,216 - OMNICHANNEL RETAILING THE ROLE OF SITUATIONAL INVOLVEMENT IN FACILITATING CONSUMER EXPERIENCES.pdf,EFFECTS OF INCREASED OMNICHANNEL INTEGRATION ON CUSTOMER SATISFACTION AND LOYALTY INTENTIONS,YES,On Google Drive Folder
217,,OMNICHANNEL RETAILING: THE ROLE OF SITUATIONAL INVOLVEMENT IN FACILITATING CONSUMER EXPERIENCES,NO,On Google Drive Folder
218,,OMNICHANNEL RETAIL MOVE IN A DUAL-CHANNEL SUPPLY CHAIN,NO,Cancelled by ILL Staff
219,219 - QUALITY OF CHANNEL INTEGRATION AND CUSTOMER LOYALTY IN OMNICHANNEL RETAILING THE MEDIATING ROLE OF CUSTOMER ENGAGEMENT.pdf,QUALITY OF CHANNEL INTEGRATION AND CUSTOMER LOYALTY IN OMNICHANNEL RETAILING: THE MEDIATING ROLE OF CUSTOMER ENGAGEMENT AND RELATIONSHIP PROGRAM RECEPTIVENESS,YES,On Google Drive Folder
220,220 - CHALLENGING THE INTEGRATION IMPERATIVE A CUSTOMER PERSPECTIVE ON OMNICHANNEL JOURNEYS.pdf,OPTIMAL ORDERING DECISIONS FOR AN OMNICHANNEL RETAILER WITH SHIP-TO-STORE AND SHIP-FROM-STORE,YES,On Google Drive Folder
221,,"CHALLENGING THE ""INTEGRATION IMPERATIVE"": A CUSTOMER PERSPECTIVE ON OMNICHANNEL JOURNEYS",NO,On Google Drive Folder
222,222 - A TYPOLOGY OF OMNICHANNEL RETAILER ACTIVITIES DURING THE COVID-19 PANDEMIC.pdf,THE IMPACT OF RISK PERCEPTIONS ON THE ATTITUDE TOWARD MULTI-CHANNEL TECHNOLOGIES,YES,On Google Drive Folder
223,,A TYPOLOGY OF OMNICHANNEL RETAILER ACTIVITIES DURING THE COVID-19 PANDEMIC,NO,On Google Drive Folder
224,224 - CONSUMER-BASED SUPPLY CHAIN MANAGEMENT PERFORMANCE RESEARCH A STRUCTURED LITERATURE REVIEW.pdf,CONSUMER-BASED SUPPLY CHAIN MANAGEMENT PERFORMANCE RESEARCH: A STRUCTURED LITERATURE REVIEW,YES,On Google Drive Folder
225,"225 - LARGE-SCALE RETAILERS, DIGITAL MEDIA AND IN-STORE COMMUNICATIONS.pdf","LARGE-SCALE RETAILERS, DIGITAL MEDIA AND IN-STORE COMMUNICATIONS",YES,On Google Drive Folder
226,226 - PLANNED OR UNPLANNED PURCHASES THE EFFECTS OF PERCEIVED VALUES ON OMNICHANNEL CONTINUANCE INTENTION.pdf,DESIGNING A SEAMLESS SHOPPING JOURNEY THROUGH OMNICHANNEL RETAILER INTEGRATION,YES,On Google Drive Folder
227,,PLANNED OR UNPLANNED PURCHASES? THE EFFECTS OF PERCEIVED VALUES ON OMNICHANNEL CONTINUANCE INTENTION,NO,On Google Drive Folder
228,228 - OMNICHANNEL RETAILING EXPLORING FUTURE RESEARCH AVENUES IN RETAIL MARKETING AND DISTRIBUTION MANAGEMENT.pdf,OMNICHANNEL RETAILING: EXPLORING FUTURE RESEARCH AVENUES IN RETAIL MARKETING AND DISTRIBUTION MANAGEMENT,YES,On Google Drive Folder
229,229 - Authentic omnichannel  Providing consumers with a seamless brand experience.pdf,COUPON PROMOTION AND INVENTORY STRATEGIES OF A SUPPLIER CONSIDERING AN E-COMMERCE PLATFORM'S OMNICHANNEL COUPONS,YES,On Google Drive Folder
230,,AUTHENTIC OMNICHANNEL: PROVIDING CONSUMERS WITH A SEAMLESS BRAND EXPERIENCE THROUGH AUTHENTICITY,NO,On Google Drive Folder
231,"231 - PERCEIVED OMNICHANNEL CUSTOMER EXPERIENCE (OCX) CONCEPT, MEASUREMENT, AND IMPACT.pdf",SEAMLESS EXPERIENCE IN THE CONTEXT OF OMNICHANNEL SHOPPING: SCALE DEVELOPMENT AND EMPIRICAL VALIDATION,YES,On Google Drive Folder
232,232 - OMNICHANNEL RETAILER BRAND EXPERIENCE CONCEPTUALISATION AND PROPOSAL OF A COMPREHENSIVE SCALE.pdf,"PERCEIVED OMNICHANNEL CUSTOMER EXPERIENCE (OCX): CONCEPT, MEASUREMENT, AND IMPACT",YES,On Google Drive Folder
233,233 - DETERMINANTS OF CONSUMERS_ WILLINGNESS TO PARTICIPATE IN FAST FASHION BRANDS_ USED CLOTHES RECYCLING PLANS IN AN OMNICHANNEL RETAIL.pdf,OMNICHANNEL RETAILER BRAND EXPERIENCE: CONCEPTUALISATION AND PROPOSAL OF A COMPREHENSIVE SCALE,YES,On Google Drive Folder
234,,DETERMINANTS OF CONSUMERS' WILLINGNESS TO PARTICIPATE IN FAST FASHION BRANDS' USED CLOTHES RECYCLING PLANS IN AN OMNICHANNEL RETAIL ENVIRONMENT,NO,On Google Drive Folder
235,235 - MARKETING AND OPERATIONAL STRATEGIES DURING THE COVID-19 PANDEMIC A CASE STUDY OF A HONG KONG FOOTWEAR ENTERPRISE.pdf,MARKETING AND OPERATIONAL STRATEGIES DURING THE COVID-19 PANDEMIC: A CASE STUDY OF A HONG KONG FOOTWEAR ENTERPRISE,YES,On Google Drive Folder
236,236 - OMNICHANNEL RETAILING AND POST-PANDEMIC RECOVERY BUILDING A RESEARCH AGENDA.pdf,THE ROLE OF ARTIFICIAL INTELLIGENCE IN IMPROVING THE OMNICHANNEL CUSTOMER EXPERIENCE,YES,On Google Drive Folder
237,237 - TRANSITIONING FROM MULTICHANNEL TO OMNICHANNEL CUSTOMER EXPERIENCE IN SERVICE-BASED COMPANIES CHALLENGES AND COPING STRATEGIES.pdf,OMNICHANNEL RETAILING AND POST-PANDEMIC RECOVERY: BUILDING A RESEARCH AGENDA,YES,On Google Drive Folder
238,238 - AN ANALYSIS OF FACTORS INFLUENCING OMNICHANNEL RETAILING ADOPTION USING ISM-DEMATEL APPROACH AN INDIAN PERSPECTIVE.pdf,TRANSITIONING FROM MULTICHANNEL TO OMNICHANNEL CUSTOMER EXPERIENCE IN SERVICE-BASED COMPANIES: CHALLENGES AND COPING STRATEGIES,YES,On Google Drive Folder
239,239 - OMNICHANNEL MANAGEMENT IN B2B. COMPLEXITY-BASED MODEL. EMPIRICAL EVIDENCE FROM A PANEL OF EXPERTS BASED ON FUZZY COGNITIVE MAPS.pdf,AN ANALYSIS OF FACTORS INFLUENCING OMNICHANNEL RETAILING ADOPTION USING ISM-DEMATEL APPROACH: AN INDIAN PERSPECTIVE,YES,On Google Drive Folder
240,240 - THE DRIVER OF PURCHASE INTENTIONS IN OMNICHANNEL RETAIL PERCEIVED VALUE EXAMINATION.pdf,OMNICHANNEL MANAGEMENT IN B2B. COMPLEXITY-BASED MODEL. EMPIRICAL EVIDENCE FROM A PANEL OF EXPERTS BASED ON FUZZY COGNITIVE MAPS,YES,On Google Drive Folder
241,,THE DRIVER OF PURCHASE INTENTIONS IN OMNICHANNEL RETAIL: PERCEIVED VALUE EXAMINATION,NO,On Google Drive Folder
242,242 - VALUE CREATION THROUGH OMNICHANNEL PRACTICES FOR MULTI-ACTOR CUSTOMERS AN EVOLUTIONARY VIEW.pdf,CONSUMER PATRONAGE IN OMNICHANNEL RETAILING AND THE MODERATING IMPACT OF CULTURE: A METASEM REVIEW,YES,On Google Drive Folder
243,,VALUE CREATION THROUGH OMNICHANNEL PRACTICES FOR MULTI-ACTOR CUSTOMERS: AN EVOLUTIONARY VIEW,NO,On Google Drive Folder
244,244 - CONSUMER WILLINGNESS TO PAY ACROSS RETAIL CHANNELS.pdf,CONSUMER WILLINGNESS TO PAY ACROSS RETAIL CHANNELS,YES,On Google Drive Folder
245,245 - THE INFLUENCE OF RETURN CHANNEL TYPE ON THE RELATIONSHIP BETWEEN RETURN SERVICE QUALITY AND CUSTOMER LOYALTY IN OMNICHANNEL RETAILING.pdf,THE INFLUENCE OF RETURN CHANNEL TYPE ON THE RELATIONSHIP BETWEEN RETURN SERVICE QUALITY AND CUSTOMER LOYALTY IN OMNICHANNEL RETAILING,YES,On Google Drive Folder
246,246 - A SIMULATION MODEL OF MULTI-ECHELON RETAIL INVENTORY WITH CROSS-CHANNEL PRODUCT RETURNS.pdf,ASSORTMENT OPTIMIZATION USING AN ATTRACTION MODEL IN AN OMNICHANNEL ENVIRONMENT,YES,On Google Drive Folder
247,247 - OMNICHANNEL RETAILING A BIBLIOMETRIC AND NETWORK VISUALIZATION ANALYSIS.pdf,A SIMULATION MODEL OF MULTI-ECHELON RETAIL INVENTORY WITH CROSS-CHANNEL PRODUCT RETURNS,YES,On Google Drive Folder
248,248 - THE IMPACTS OF OMNICHANNEL RETAILING PROPERTIES ON CUSTOMER EXPERIENCE AND BRAND LOYALTY A STUDY IN THE BANKING SECTOR.pdf,OMNICHANNEL RETAILING: A BIBLIOMETRIC AND NETWORK VISUALIZATION ANALYSIS,YES,On Google Drive Folder
249,249 - BARRIERS IN OMNICHANNEL RETAILING RETURNS A CONCEPTUAL FRAMEWORK.pdf,THE IMPACTS OF OMNICHANNEL RETAILING PROPERTIES ON CUSTOMER EXPERIENCE AND BRAND LOYALTY: A STUDY IN THE BANKING SECTOR,YES,On Google Drive Folder
250,250 - DEMAND-ENHANCING SERVICES FOR TANGIBLE PRODUCTS IN A DISTRIBUTION SYSTEM WITH ONLINE AND OFF-LINE CHANNELS.pdf,BARRIERS IN OMNICHANNEL RETAILING RETURNS: A CONCEPTUAL FRAMEWORK,YES,On Google Drive Folder
251,251 - A COMPARISON OF THE ENVIRONMENTAL SUSTAINABILITY OF BRICK-AND-MORTAR RETAILING AND ONLINE RETAILING.pdf,DEMAND-ENHANCING SERVICES FOR TANGIBLE PRODUCTS IN A DISTRIBUTION SYSTEM WITH ONLINE AND OFF-LINE CHANNELS,YES,On Google Drive Folder
252,252 - CONTRIBUTIONS OF INDUSTRY 4.0 TO SUPPLY CHAIN RESILIENCE.pdf,A COMPARISON OF THE ENVIRONMENTAL SUSTAINABILITY OF BRICK-AND-MORTAR RETAILING AND ONLINE RETAILING: CONTRASTING ACADEMIC RESEARCH AND CONSUMER PERCEPTIONS,YES,On Google Drive Folder
253,253 - LOGISTICS OUTSOURCING IN OMNICHANNEL RETAIL STATE OF PRACTICE AND SERVICE RECOMMENDATIONS.pdf,CONTRIBUTIONS OF INDUSTRY 4.0 TO SUPPLY CHAIN RESILIENCE,YES,On Google Drive Folder
254,254 - EXPLORING THE ROLE OF OMNICHANNEL RETAILING TECHNOLOGIES FUTURE RESEARCH DIRECTIONS.pdf,LOGISTICS OUTSOURCING IN OMNICHANNEL RETAIL STATE OF PRACTICE AND SERVICE RECOMMENDATIONS,YES,On Google Drive Folder
255,255 - LOYALTY CARD ADOPTION IN SME RETAILERS THE IMPACT UPON MARKETING MANAGEMENT.pdf,EXPLORING THE ROLE OF OMNICHANNEL RETAILING TECHNOLOGIES: FUTURE RESEARCH DIRECTIONS,YES,On Google Drive Folder
256,"256 - THE CHANGING FACE OF RETAILING, 1980-2020.pdf",LOYALTY CARD ADOPTION IN SME RETAILERS: THE IMPACT UPON MARKETING MANAGEMENT,YES,On Google Drive Folder
257,257 - EFFECTS OF INFORMATION TECHNOLOGY COMPETENCE ON BUSINESS PERFORMANCE EMPIRICAL EVIDENCE FROM OMNICHANNEL RETAILERS IN VIETNAM.pdf,"THE CHANGING FACE OF RETAILING, 1980-2020",YES,On Google Drive Folder
