item,filename,article_title,in_folder,notes
258,,EFFECTS OF INFORMATION TECHNOLOGY COMPETENCE ON BUSINESS PERFORMANCE: EMPIRICAL EVIDENCE FROM OMNICHANNEL RETAILERS IN VIETNAM,NO,On Google Drive Folder
259,259 - WHAT OMNICHANNEL REALLY MEANS.pdf,EXPLORING OMNICHANNEL STRATEGIES: A PATH TO IMPROVE CUSTOMER EXPERIENCES,YES,On Google Drive Folder
260,260 - POWER STRUCTURE AND PRICING IN AN OMNICHANNEL WITH BUY-ONLINE-AND-PICK-UP-IN-STORE.pdf,WHAT OMNICHANNEL REALLY MEANS?,YES,On Google Drive Folder
261,261 - QUICK RESPONSE AND OMNICHANNEL RETAIL OPERATIONS WITH THE SHIP-TO-STORE PROGRAM.pdf,POWER STRUCTURE AND PRICING IN AN OMNICHANNEL WITH BUY-ONLINE-AND-PICK-UP-IN-STORE,YES,On Google Drive Folder
262,262 - GOING WITH THE FLOW SMART SHOPPING MALLS AND OMNICHANNEL RETAILING.pdf,QUICK RESPONSE AND OMNICHANNEL RETAIL OPERATIONS WITH THE SHIP-TO-STORE PROGRAM,YES,On Google Drive Folder
263,,GOING WITH THE FLOW: SMART SHOPPING MALLS AND OMNICHANNEL RETAILING,NO,On Google Drive Folder
264,264 - Does service journey quality explain omnichannel shoppers_ online engagement behaviors.pdf,DOES SERVICE JOURNEY QUALITY EXPLAIN OMNICHANNEL SHOPPERS&APOS; ONLINE ENGAGEMENT BEHAVIORS? THE ROLE OF CUSTOMER-STORE IDENTIFICATION AND GRATITUDE TOWARD THE STORE,YES,On Google Drive Folder
265,,O2O SWITCHING DETERMINANTS AND SUCCESSFUL DRIVERS IN OMNICHANNEL RETAILING SERVICES,NO,On Google Drive Folder
266,266 - FASHION BUSINESS CASE STUDY ON THE GERMAN CLICK & COLLECT SITUATION.pdf,FASHION BUSINESS CASE STUDY ON THE GERMAN CLICK & COLLECT SITUATION,YES,On Google Drive Folder
267,,SORTING OUT THE SORTING IN OMNICHANNEL RETAILING,NO,On Google Drive Folder
268,268 - TOTAL HOCKEY OPTIMIZES OMNICHANNEL FACILITY LOCATIONS.pdf,TOTAL HOCKEY OPTIMIZES OMNICHANNEL FACILITY LOCATIONS,YES,On Google Drive Folder
269,269 - CONSUMER SHOWROOMING WITH SUPPLIER ENCROACHMENT AND OMNICHANNEL RETAILING.pdf,"OMNICHANNEL RETAILING WITH BRAND ENGAGEMENT, TRUST AND LOYALTY IN BANKING: THE MODERATING ROLE OF PERSONAL INNOVATIVENESS",YES,On Google Drive Folder
270,270 - AN INTELLIGENT OMNICHANNEL ASSORTMENT MODEL TO MANAGE WEBROOMING AN OPTIMIZATION APPROACH.pdf,CONSUMER SHOWROOMING WITH SUPPLIER ENCROACHMENT AND OMNICHANNEL RETAILING,YES,On Google Drive Folder
271,271 - WINNING CUSTOMER SATISFACTION TOWARD OMNICHANNEL LOGISTICS SERVICE QUALITY BASED ON AN INTEGRATED IMPORTANCE-PERFORMANCE ANALYSIS AND THREE-FACTOR THEORY.pdf,AN INTELLIGENT OMNICHANNEL ASSORTMENT MODEL TO MANAGE WEBROOMING: AN OPTIMIZATION APPROACH,YES,On Google Drive Folder
272,,WINNING CUSTOMER SATISFACTION TOWARD OMNICHANNEL LOGISTICS SERVICE QUALITY BASED ON AN INTEGRATED IMPORTANCE-PERFORMANCE ANALYSIS AND THREE-FACTOR THEORY: INSIGHT FROM THAILAND,NO,On Google Drive Folder
273,273 - OMNICHANNEL RETAILING STRATEGY A SYSTEMATIC REVIEW.pdf,OMNICHANNEL RETAILING STRATEGY: A SYSTEMATIC REVIEW,YES,On Google Drive Folder
274,274 - OMNICHANNEL SUPPLY CHAIN OPERATIONS FOR LUXURY PRODUCTS WITH CONSPICUOUS CONSUMERS.pdf,OMNICHANNEL SUPPLY CHAIN OPERATIONS FOR LUXURY PRODUCTS WITH CONSPICUOUS CONSUMERS,YES,On Google Drive Folder
275,275 - CHOOSING OPTIMAL OMNICHANNEL COUPON REDEEMING OPTIONS IN MULTIPLE CHANNEL SETTINGS.pdf,EXAMINING THE GLOBAL RETAIL APOCALYPSE DURING THE COVID-19 PANDEMIC USING STRATEGIC OMNICHANNEL MANAGEMENT: A CONSUMERS' DATA PRIVACY AND DATA SECURITY PERSPECTIVE,YES,On Google Drive Folder
276,,CHOOSING OPTIMAL OMNICHANNEL COUPON REDEEMING OPTIONS IN MULTIPLE CHANNEL SETTINGS,NO,On Google Drive Folder
277,277 - INFORMATION SERVICES AND OMNICHANNEL RETAILING STRATEGY CHOICES OF E-COMMERCE PLATFORMS WITH SUPPLIER COMPETITION.pdf,CONSUMER RETURN POLICIES IN OMNICHANNEL OPERATIONS,YES,On Google Drive Folder
278,,INFORMATION SERVICES AND OMNICHANNEL RETAILING STRATEGY CHOICES OF E-COMMERCE PLATFORMS WITH SUPPLIER COMPETITION,NO,On Google Drive Folder
279,279 - SHIP-FROM-STORE STRATEGY IN PLATFORM RETAILING.pdf,"""SHIP-FROM-STORE "" STRATEGY IN PLATFORM RETAILING",YES,On Google Drive Folder
280,280 - ASSESSING OMNICHANNEL STRATEGIES FOR GLOBAL RETAILING INDUSTRIES IN A DEVELOPING COUNTRY.pdf,ASSESSING OMNICHANNEL STRATEGIES FOR GLOBAL RETAILING INDUSTRIES IN A DEVELOPING COUNTRY,YES,On Google Drive Folder
281,281 - CUSTOMER EXPERIENCES IN OMNICHANNEL RETAIL ENVIRONMENTS A THEMATIC LITERATURE REVIEW.pdf,CUSTOMER EXPERIENCES IN OMNICHANNEL RETAIL ENVIRONMENTS: A THEMATIC LITERATURE REVIEW,YES,On Google Drive Folder
282,282 - INFORMATION EFFECT OF BUY-ONLINE-AND-PICK-UP-IN-STORE IN OMNICHANNEL RETAILING WITH STORE REPLENISHMENT.pdf,THE IMPACT OF OMNICHANNEL SHOPPING EXPERIENCE AND CHANNEL INTEGRATION ON CUSTOMER RETENTION: EMPIRICAL EVIDENCE FROM CHINA,YES,On Google Drive Folder
283,283 - CHANGE IN TECHNOLOGY-ENABLED OMNICHANNEL CUSTOMER EXPERIENCES IN-STORE.pdf,INFORMATION EFFECT OF BUY-ONLINE-AND-PICK-UP-IN-STORE IN OMNICHANNEL RETAILING WITH STORE REPLENISHMENT,YES,On Google Drive Folder
284,284 -INTEGRATIVE STRATEGIES FOR OMNICHANNEL ORDER FULFILLMENT WITH RISK AVERSION.pdf,CHANGE IN TECHNOLOGY-ENABLED OMNICHANNEL CUSTOMER EXPERIENCES IN-STORE,YES,On Google Drive Folder
285,285 - LAST MILE PRACTICES IN E-COMMERCE FRAMEWORK DEVELOPMENT AND EMPIRICAL ANALYSIS OF SWEDISH FIRMS.pdf,INTEGRATIVE STRATEGIES FOR OMNICHANNEL ORDER FULFILLMENT WITH RISK AVERSION,YES,On Google Drive Folder
286,,LAST MILE PRACTICES IN E-COMMERCE: FRAMEWORK DEVELOPMENT AND EMPIRICAL ANALYSIS OF SWEDISH FIRMS,NO,On Google Drive Folder
287,287 - Does integrated store service quality explain omnichannel shoppers_ online brand advocacy behaviors.pdf,"DOES INTEGRATED STORE SERVICE QUALITY EXPLAIN OMNICHANNEL SHOPPERS&APOS; ONLINE BRAND ADVOCACY BEHAVIORS?: ROLE OF MEMORABLE SHOPPING EXPERIENCES, STORE ATTACHMENT, AND RELATIONSHIP STRENGTH",YES,On Google Drive Folder
288,288 - OMNICHANNEL FACILITY LOCATION AND FULFILLMENT OPTIMIZATION.pdf,OMNICHANNEL FACILITY LOCATION AND FULFILLMENT OPTIMIZATION,YES,On Google Drive Folder
289,289 - WHAT DRIVES OMNICHANNEL SHOPPING BEHAVIORS FASHION LIFESTYLE OF SOCIAL-LOCAL-MOBILE CONSUMERS.pdf,EXPLORING CUSTOMER EXPERIENCE DURING CHANNEL SWITCHING IN OMNICHANNEL RETAILING CONTEXT: A QUALITATIVE ASSESSMENT,YES,On Google Drive Folder
290,290 - A MODERATED MEDIATING MECHANISM OF OMNICHANNEL CUSTOMER EXPERIENCES.pdf,WHAT DRIVES OMNICHANNEL SHOPPING BEHAVIORS? FASHION LIFESTYLE OF SOCIAL-LOCAL-MOBILE CONSUMERS,YES,On Google Drive Folder
291,291 - ADAPTING THE RETAIL BUSINESS MODEL TO OMNICHANNEL STRATEGY A SUPPLY CHAIN MANAGEMENT PERSPECTIVE.pdf,A MODERATED MEDIATING MECHANISM OF OMNICHANNEL CUSTOMER EXPERIENCES,YES,On Google Drive Folder
292,292 - Celebrating IJPDLM_s 50th anniversary a reflection on its contributions and future directions.pdf,ADAPTING THE RETAIL BUSINESS MODEL TO OMNICHANNEL STRATEGY: A SUPPLY CHAIN MANAGEMENT PERSPECTIVE,YES,On Google Drive Folder
293,293 - FACEBOOK AND SUSTAINABLE DEVELOPMENT A CASE STUDY OF A FRENCH SUPERMARKET CHAIN.pdf,CELEBRATING <I>IJPDLM</I>'S 50TH ANNIVERSARY: A REFLECTION ON ITS CONTRIBUTIONS AND FUTURE DIRECTIONS,YES,On Google Drive Folder
294,,FACEBOOK AND SUSTAINABLE DEVELOPMENT: A CASE STUDY OF A FRENCH SUPERMARKET CHAIN,NO,On Google Drive Folder
295,295 - DETERMINANTS OF WEBROOMING AND SHOWROOMING BEHAVIOR A SYSTEMATIC LITERATURE REVIEW.pdf,DETERMINANTS OF WEBROOMING AND SHOWROOMING BEHAVIOR: A SYSTEMATIC LITERATURE REVIEW,YES,On Google Drive Folder
296,296 - Factors influencing omnichannel buying An exploratory study with omnishoppers in Uberlandia.pdf,FACTORS IN-LUENCING<I> OMNICHANNEL</I> BUYING: AN EXPLORATOR Y STUDY WITH OMNISHOPPERS IN UBERLANDIA/MG,YES,On Google Drive Folder
297,297 - THE FUTURE OF OMNICHANNEL RETAIL A FOUR-STAGE DELPHI STUDY.pdf,THE EFFECT OF OPTIMIZING WAREHOUSE LOCATIONS ON OMNICHANNEL DESIGNS,YES,On Google Drive Folder
298,"298 - PRICE, ONLINE COUPON, AND STORE SERVICE EFFORT DECISIONS UNDER DIFFERENT OMNICHANNEL RETAILING MODELS.pdf",THE FUTURE OF OMNICHANNEL RETAIL: A FOUR-STAGE DELPHI STUDY,YES,On Google Drive Folder
299,299 - A CROSS CULTURAL STUDY OF GENDER DIFFERENCES IN OMNICHANNEL RETAILING CONTEXTS.pdf,"PRICE, ONLINE COUPON, AND STORE SERVICE EFFORT DECISIONS UNDER DIFFERENT OMNICHANNEL RETAILING MODELS",YES,On Google Drive Folder
300,300 - OMNICHANNEL RETAILING OPERATIONS WITH COUPON PROMOTIONS.pdf,A CROSS CULTURAL STUDY OF GENDER DIFFERENCES IN OMNICHANNEL RETAILING CONTEXTS,YES,On Google Drive Folder
301,301 - OMNICHANNEL RETAILING DOES IT EMPOWER CONSUMERS AND INFLUENCE PATRONAGE.pdf,OMNICHANNEL RETAILING OPERATIONS WITH COUPON PROMOTIONS,YES,On Google Drive Folder
302,302 - RANKING OF OPPORTUNITIES FOR IMPLEMENTING THE OMNICHANNEL CONCEPT.pdf,OMNICHANNEL RETAILING: DOES IT EMPOWER CONSUMERS AND INFLUENCE PATRONAGE?,YES,On Google Drive Folder
303,303 - HAVE AN OMNICHANNEL SEAMLESS INTERACTION EXPERIENCE DIMENSIONS AND EFFECT ON CONSUMER SATISFACTION.pdf,RANKING OF OPPORTUNITIES FOR IMPLEMENTING THE OMNICHANNEL CONCEPT,YES,On Google Drive Folder
304,,HAVE AN OMNICHANNEL SEAMLESS INTERACTION EXPERIENCE! DIMENSIONS AND EFFECT ON CONSUMER SATISFACTION,NO,On Google Drive Folder
305,305 - SERVICE INTEGRATION IN OMNICHANNEL RETAILING AND ITS IMPACT ON CUSTOMER EXPERIENCE.pdf,SERVICE INTEGRATION IN OMNICHANNEL RETAILING AND ITS IMPACT ON CUSTOMER EXPERIENCE,YES,On Google Drive Folder
306,306 - RESPONDING TO SUPPLY CHAIN DISRUPTIONS CAUSED BY THE COVID-19 PANDEMIC A BLACK SWAN EVENT FOR OMNICHANNEL RETAILERS.pdf,ZONING STRATEGIES FOR HUMAN-ROBOT COLLABORATIVE PICKING,YES,On Google Drive Folder
307,307 - OMNICHANNEL FASHION RETAILING EXAMINING THE CUSTOMER DECISION-MAKING JOURNEY.pdf,RESPONDING TO SUPPLY CHAIN DISRUPTIONS CAUSED BY THE COVID-19 PANDEMIC: A BLACK SWAN EVENT FOR OMNICHANNEL RETAILERS,YES,On Google Drive Folder
308,308 - A DECISION SUPPORT SYSTEM FOR RETAIL ASSORTMENT PLANNING.pdf,OMNICHANNEL FASHION RETAILING: EXAMINING THE CUSTOMER DECISION-MAKING JOURNEY,YES,On Google Drive Folder
309,309 - LINKS AND EFFECTS OF CHANNEL INTEGRATION IN THE PREPURCHASE AND PURCHASE STAGES OF OMNICHANNEL RETAILERS.pdf,A DECISION SUPPORT SYSTEM FOR RETAIL ASSORTMENT PLANNING,YES,On Google Drive Folder
310,310 - IMPULSE BUYING BEHAVIOUR IN OMNICHANNEL RETAIL AN APPROACH THROUGH THE STIMULUS-ORGANISM-RESPONSE THEORY.pdf,LINKS AND EFFECTS OF CHANNEL INTEGRATION IN THE PREPURCHASE AND PURCHASE STAGES OF OMNICHANNEL RETAILERS,YES,On Google Drive Folder
311,311 - IDENTIFYING AND ANALYSIS OF KEY FLEXIBLE SUSTAINABLE SUPPLY CHAIN MANAGEMENT STRATEGIES TOWARD OVERCOMING THE POST-COVID-19 IMPACTS.pdf,IMPULSE BUYING BEHAVIOUR IN OMNICHANNEL RETAIL: AN APPROACH THROUGH THE STIMULUS-ORGANISM-RESPONSE THEORY,YES,On Google Drive Folder
312,312 - SHOULD THE ASSEMBLY SYSTEM WITH DIRECT OMNICHANNEL INTRODUCE INTEGRATED MANAGEMENT SERVICE A GAME-THEORETICAL MODELLING STUDY.pdf,IDENTIFYING AND ANALYSIS OF KEY FLEXIBLE SUSTAINABLE SUPPLY CHAIN MANAGEMENT STRATEGIES TOWARD OVERCOMING THE POST-COVID-19 IMPACTS,YES,On Google Drive Folder
313,313 - DO OR DIE THE EFFECTS OF COVID-19 ON CHANNEL INTEGRATION AND DIGITAL TRANSFORMATION OF LARGE CLOTHING AND APPAREL RETAILERS IN SPAIN.pdf,SHOULD THE ASSEMBLY SYSTEM WITH DIRECT OMNICHANNEL INTRODUCE INTEGRATED MANAGEMENT SERVICE? A GAME-THEORETICAL MODELLING STUDY,YES,On Google Drive Folder
314,314 - THE OMNICHANNEL CONTINUUM INTEGRATING ONLINE AND OFFLINE CHANNELS ALONG THE CUSTOMER JOURNEY.pdf,DO OR DIE? THE EFFECTS OF COVID-19 ON CHANNEL INTEGRATION AND DIGITAL TRANSFORMATION OF LARGE CLOTHING AND APPAREL RETAILERS IN SPAIN,YES,On Google Drive Folder
315,,THE OMNICHANNEL CONTINUUM: INTEGRATING ONLINE AND OFFLINE CHANNELS ALONG THE CUSTOMER JOURNEY,NO,On Google Drive Folder
316,316 - THE EFFECT OF MULTICHANNEL AND OMNICHANNEL RETAILING ON PHYSICAL STORES.pdf,THE EFFECT OF MULTICHANNEL AND OMNICHANNEL RETAILING ON PHYSICAL STORES,YES,On Google Drive Folder
317,317 - OFFLINE-CHANNEL PLANNING IN SMART OMNICHANNEL RETAILING.pdf,LOCATION OPTIMIZATION OF OFFLINE PHYSICAL STORES BASED ON MNL MODEL UNDER BOPS OMNICHANNEL,YES,On Google Drive Folder
318,318 - MAKING OMNICHANNEL AN AUGMENTED REALITY THE CURRENT AND FUTURE STATE OF THE ART.pdf,OFFLINE-CHANNEL PLANNING IN SMART OMNICHANNEL RETAILING,YES,On Google Drive Folder
319,,MAKING OMNICHANNEL AN AUGMENTED REALITY: THE CURRENT AND FUTURE STATE OF THE ART,NO,On Google Drive Folder
320,320 - FORAYS INTO OMNICHANNEL AN ONLINE RETAILER_S STRATEGIES FOR MANAGING PRODUCT RETURNS.pdf,FORAYS INTO OMNICHANNEL: AN ONLINE RETAILER'S STRATEGIES FOR MANAGING PRODUCT RETURNS,YES,On Google Drive Folder
321,321 - OMNICHANNEL OF PRIVATE LABEL GROCERY PRODUCTS IN TESCO AND CARREFOUR RETAIL CHAINS ON THE POLISH MARKET.pdf,INTEROPERABILITY OF ONLINE LOYALTY AND OFFLINE LOYALTY IN OMNICHANNEL RETAILING SERVICE: SEEKING INNOVATION IN RETAIL INDUSTRY,YES,On Google Drive Folder
322,322 - THE IMPACT OF OMNICHANNEL INTEGRATED MARKETING COMMUNICATIONS (IMC) ON PRODUCT AND RETAIL SERVICE SATISFACTION.pdf,OMNICHANNEL OF PRIVATE LABEL GROCERY PRODUCTS IN TESCO AND CARREFOUR RETAIL CHAINS ON THE POLISH MARKET,YES,On Google Drive Folder
323,"323 - IDENTIFYING OMNICHANNEL DEAL PRONE SEGMENTS, THEIR ANTECEDENTS, AND THEIR CONSEQUENCES.pdf",THE IMPACT OF OMNICHANNEL INTEGRATED MARKETING COMMUNICATIONS (IMC) ON PRODUCT AND RETAIL SERVICE SATISFACTION,YES,On Google Drive Folder
324,324 - WHICH FUTURE PATH TO PICK A CONTINGENCY APPROACH TO OMNICHANNEL WAREHOUSE CONFIGURATION.pdf,"IDENTIFYING OMNICHANNEL DEAL PRONE SEGMENTS, THEIR ANTECEDENTS, AND THEIR CONSEQUENCES",YES,On Google Drive Folder
325,325 - OMNICHANNEL AS A DRIVER OF DIGITALIZATION EVIDENCE FROM THE EMERGING MARKET IN THE FASHION INDUSTRY.pdf,WHICH FUTURE PATH TO PICK? A CONTINGENCY APPROACH TO OMNICHANNEL WAREHOUSE CONFIGURATION,YES,On Google Drive Folder
326,326 - FOOD DELIVERY APP CONTINUANCE A DUAL MODEL AND SEGMENTATION APPROACH.pdf,OMNICHANNEL AS A DRIVER OF DIGITALIZATION: EVIDENCE FROM THE EMERGING MARKET IN THE FASHION INDUSTRY,YES,On Google Drive Folder
327,327 - BRANDED CONTENT AND CONSUMER ENGAGEMENT ON FACEBOOK AN ANALYSIS OF OMNICHANNEL RETAIL.pdf,FOOD DELIVERY APP CONTINUANCE: A DUAL MODEL AND SEGMENTATION APPROACH,YES,On Google Drive Folder
328,,BRANDED CONTENT AND CONSUMER ENGAGEMENT ON FACEBOOK: AN ANALYSIS OF OMNICHANNEL RETAIL,NO,On Google Drive Folder
329,329 - CONCEPTUALIZING GREEN STRATEGIES_ EFFECTS ON CUSTOMER EXPERIENCE IN THE CONTEXT OF OMNICHANNEL RETAILING.pdf,CONCEPTUALIZING GREEN STRATEGIES' EFFECTS ON CUSTOMER EXPERIENCE IN THE CONTEXT OF OMNICHANNEL RETAILING,YES,On Google Drive Folder
330,330 - OMNICHANNEL-BASED PROMOTIONS_ EFFECTS ON PURCHASE BEHAVIOR AND BRAND IMAGE.pdf,OMNICHANNEL-BASED PROMOTIONS' EFFECTS ON PURCHASE BEHAVIOR AND BRAND IMAGE,YES,On Google Drive Folder
331,331 - OMNICHANNEL BATTLE BETWEEN AMAZON AND WALMART IS THE FOCUS ON DELIVERY THE BEST STRATEGY.pdf,OMNICHANNEL BATTLE BETWEEN AMAZON AND WALMART: IS THE FOCUS ON DELIVERY THE BEST STRATEGY?,YES,On Google Drive Folder
332,332 - THE TEST OF VUCA TIME FOR RETAIL 4.0 IMPACTED BY THE INDUSTRY 4.0 TECHNOLOGIES.pdf,"THE TEST OF VUCA TIME FOR RETAIL 4.0 IMPACTED BY THE INDUSTRY 4.0 TECHNOLOGIES, BY CREATING CUSTOMERS' REAL-TIME DIGITAL EXPERIENCE, FASTER RECOVERING FROM THE PANDEMIC, AND ADAPTING TO THE NEXT NORMAL",YES,On Google Drive Folder
333,333 - ONLINE VERSUS OFFLINE PREFERRED RETAIL CHOICE FOR PREMIUM BRAND PURCHASE.pdf,IMPACT OF OMNICHANNEL INTEGRATION ON MILLENNIALS' PURCHASE INTENTION FOR FASHION RETAILER,YES,On Google Drive Folder
334,,ONLINE VERSUS OFFLINE: PREFERRED RETAIL CHOICE FOR PREMIUM BRAND PURCHASE,NO,On Google Drive Folder
335,335 - STRATEGIC ORIENTATION TOWARDS DIGITIZATION TO IMPROVE SUPERMARKET LOYALTY IN AN OMNICHANNEL CONTEXT.pdf,CUSTOMIZATION STRATEGIES BETWEEN ONLINE AND OFFLINE RETAILERS,YES,On Google Drive Folder
336,,STRATEGIC ORIENTATION TOWARDS DIGITIZATION TO IMPROVE SUPERMARKET LOYALTY IN AN OMNICHANNEL CONTEXT,NO,On Google Drive Folder
337,337 - OMNICHANNEL AS A COMPETITIVE STRATEGY A CONCEPTUAL AND DIMENSIONAL REVIEW.pdf,OMNICHANNEL AS A COMPETITIVE STRATEGY: A CONCEPTUAL AND DIMENSIONAL REVIEW,YES,On Google Drive Folder
338,338 - USING BEST-WORST SCALING TO REVEAL PERCEIVED RELATIVE IMPORTANCE OF WEBSITE ATTRIBUTES.pdf,PICKER ROUTING IN THE MIXED-SHELVES WAREHOUSES OF E-COMMERCE RETAILERS,YES,On Google Drive Folder
339,339 - BUY ONLINE AND PICKUP IN-STORE CO-OPETITION STRATEGY OF OMNICHANNEL SUPPLY CHAIN PLAYERS.pdf,USING BEST-WORST SCALING TO REVEAL PERCEIVED RELATIVE IMPORTANCE OF WEBSITE ATTRIBUTES,YES,On Google Drive Folder
340,"340 - THE NEXT DAY, FREE DELIVERY MYTH UNRAVELLED POSSIBILITIES FOR SUSTAINABLE LAST MILE TRANSPORT IN AN OMNICHANNEL ENVIRONMENT.pdf",BUY ONLINE AND PICKUP IN-STORE: CO-OPETITION STRATEGY OF OMNICHANNEL SUPPLY CHAIN PLAYERS,YES,On Google Drive Folder
341,341 - DIRECTION OF LUXURY FASHION RETAILERS_ POST-ENTRY EXPANSION - THE EVIDENCE FROM CHINA.pdf,"THE ""NEXT DAY, FREE DELIVERY"" MYTH UNRAVELLED POSSIBILITIES FOR SUSTAINABLE LAST MILE TRANSPORT IN AN OMNICHANNEL ENVIRONMENT",YES,On Google Drive Folder
342,342 - DISENTANGLING THE IMPACT OF OMNICHANNEL INTEGRATION ON CONSUMER BEHAVIOR IN INTEGRATED SALES CHANNELS.pdf,DIRECTION OF LUXURY FASHION RETAILERS' POST-ENTRY EXPANSION - THE EVIDENCE FROM CHINA,YES,On Google Drive Folder
343,343 - RESEARCH IN OMNICHANNEL RETAIL A SYSTEMATIC REVIEW AND QUANTITATIVE CONTENT ANALYSIS.pdf,DISENTANGLING THE IMPACT OF OMNICHANNEL INTEGRATION ON CONSUMER BEHAVIOR IN INTEGRATED SALES CHANNELS,YES,On Google Drive Folder
344,,RESEARCH IN OMNICHANNEL RETAIL: A SYSTEMATIC REVIEW AND QUANTITATIVE CONTENT ANALYSIS,NO,On Google Drive Folder
345,345 - EXPLORING PHYGITAL OMNICHANNEL LUXURY RETAILING FOR IMMERSIVE CUSTOMER EXPERIENCE THE ROLE OF RAPPORT AND SOCIAL ENGAGEMENT.pdf,EXPLORING PHYGITAL OMNICHANNEL LUXURY RETAILING FOR IMMERSIVE CUSTOMER EXPERIENCE: THE ROLE OF RAPPORT AND SOCIAL ENGAGEMENT,YES,On Google Drive Folder
346,,OFFLINE SHOWROOMS IN OMNICHANNEL RETAIL: DEMAND AND OPERATIONAL BENEFITS,NO,On Google Drive Folder
347,347 - AN OPTIMAL DECISION FOR THE FRESH FOOD SUPPLY CHAIN NETWORK UNDER OMNICHANNEL CONTEXT.pdf,AN OPTIMAL DECISION FOR THE FRESH FOOD SUPPLY CHAIN NETWORK UNDER OMNICHANNEL CONTEXT,YES,On Google Drive Folder
348,348 - PERSONALIZATION AND HEDONIC MOTIVATION IN CREATING CUSTOMER EXPERIENCES AND LOYALTY IN OMNICHANNEL RETAIL.pdf,CRAFTING THE CUSTOMER EXPERIENCE IN OMNICHANNEL CONTEXTS: THE ROLE OF CHANNEL INTEGRATION,YES,On Google Drive Folder
349,349 - BENEFIT FROM A HIGH STORE VISITING COST IN AN OMNICHANNEL WITH BOPS.pdf,PERSONALIZATION AND HEDONIC MOTIVATION IN CREATING CUSTOMER EXPERIENCES AND LOYALTY IN OMNICHANNEL RETAIL,YES,On Google Drive Folder
350,350 - GROCERY OMNICHANNEL PERISHABLE INVENTORIES PERFORMANCE MEASURES AND INFLUENCING FACTORS.pdf,BENEFIT FROM A HIGH STORE VISITING COST IN AN OMNICHANNEL WITH BOPS,YES,On Google Drive Folder
351,351 - HOW TO SHIFT CONSUMER WILLINGNESS TO USE THE EMERGING TECHNOLOGIES ON OMNICHANNEL.pdf,GROCERY OMNICHANNEL PERISHABLE INVENTORIES: PERFORMANCE MEASURES AND INFLUENCING FACTORS,YES,On Google Drive Folder
352,,HOW TO SHIFT CONSUMER WILLINGNESS TO USE THE EMERGING TECHNOLOGIES ON OMNICHANNEL,NO,On Google Drive Folder
353,353 - THE DIFFERENT PHASES OF THE OMNICHANNEL CONSUMER BUYING JOURNEY A SYSTEMATIC LITERATURE REVIEW AND FUTURE RESEARCH DIRECTIONS.pdf,"DOES INTEGRATED STORE SERVICE QUALITY TURN OMNICHANNEL SHOPPERS INTO PRICE-INSENSITIVE, CROSS-CATEGORY PURCHASERS, AND LOYAL WEBROOMERS? MODERATING ROLE OF PERCEIVED RELATIONSHIP INVESTMENT AND ALTERNATIVE RETAILER ATTRACTIVENESS",YES,On Google Drive Folder
354,354 - OPTIMAL IN-STORE INVENTORY POLICY FOR OMNICHANNEL RETAILERS IN FRANCHISING NETWORKS.pdf,THE DIFFERENT PHASES OF THE OMNICHANNEL CONSUMER BUYING JOURNEY: A SYSTEMATIC LITERATURE REVIEW AND FUTURE RESEARCH DIRECTIONS,YES,On Google Drive Folder
355,355 - OMNICHANNEL RETAILING A TALE OF THREE SECTORS.pdf,OPTIMAL IN-STORE INVENTORY POLICY FOR OMNICHANNEL RETAILERS IN FRANCHISING NETWORKS,YES,On Google Drive Folder
356,"356 - DISTRIBUTIONALLY ROBUST MULTIPERIOD INVENTORY MODEL FOR OMNICHANNEL RETAILING CONSIDERING BUY-ONLINE, PICKUP-IN-STORE AND OUT-OF-STOCK, HOME-DELIVERY SERVICES.pdf",OMNICHANNEL RETAILING: A TALE OF THREE SECTORS,YES,On Google Drive Folder
357,"357 - EFFECTS OF CUSTOMER RESPONSE TO FASHION PRODUCT STOCKOUT ON HOLDING COSTS, ORDER SIZES, AND PROFITABILITY IN OMNICHANNEL RETAILING.pdf","DISTRIBUTIONALLY ROBUST MULTIPERIOD INVENTORY MODEL FOR OMNICHANNEL RETAILING CONSIDERING BUY-ONLINE, PICKUP-IN-STORE AND OUT-OF-STOCK, HOME-DELIVERY SERVICES",YES,On Google Drive Folder
358,358 - MOBILE-ASSISTED SHOWROOMERS UNDERSTANDING THEIR PURCHASE JOURNEY AND PERSONALITIES.pdf,"EFFECTS OF CUSTOMER RESPONSE TO FASHION PRODUCT STOCKOUT ON HOLDING COSTS, ORDER SIZES, AND PROFITABILITY IN OMNICHANNEL RETAILING",YES,On Google Drive Folder
359,359 - PRICE PROMOTION IN OMNICHANNEL RETAILING HOW MUCH IS TOO MUCH.pdf,MOBILE-ASSISTED SHOWROOMERS: UNDERSTANDING THEIR PURCHASE JOURNEY AND PERSONALITIES,YES,On Google Drive Folder
360,360 - INVENTORY CONTROL FOR OMNICHANNEL RETAILING BETWEEN ONE WAREHOUSE AND MULTIPLE STORES.pdf,PRICE PROMOTION IN OMNICHANNEL RETAILING: HOW MUCH IS TOO MUCH?,YES,On Google Drive Folder
361,,INVENTORY CONTROL FOR OMNICHANNEL RETAILING BETWEEN ONE WAREHOUSE AND MULTIPLE STORES,NO,On Google Drive Folder
362,362 - HOW INTEGRATED STORE-SERVICE QUALITY PROMOTES OMNICHANNEL SHOPPERS_ WORD-OF-MOUTH BEHAVIORS.pdf,HOW INTEGRATED STORE-SERVICE QUALITY PROMOTES OMNICHANNEL SHOPPERS' WORD-OF-MOUTH BEHAVIORS: THE MODERATING ROLE OF PERCEIVED RELATIONSHIP INVESTMENT AND THE SHOPPER'S PERCEIVED VALUE,YES,On Google Drive Folder
363,363 - ROBUST OMNICHANNEL RETAIL OPERATIONS WITH THE IMPLEMENTATION OFSHIP-FROM-STORE.pdf,ROBUST OMNICHANNEL RETAIL OPERATIONS WITH THE IMPLEMENTATION OFSHIP-FROM-STORE,YES,On Google Drive Folder
364,364 - WHO STILL SHOPS AT OMNICHANNEL FASHION DEPARTMENT STORES AN ANALYSIS OF GENERATIONAL COHORTS AND INTENT TO PURCHASE.pdf,CUSTOMERS' TOLERANCE FOR VALIDATION IN OMNICHANNEL RETAIL STORES: ENABLING LOGISTICS AND SUPPLY CHAIN ANALYTICS,YES,On Google Drive Folder
365,,WHO STILL SHOPS AT OMNICHANNEL FASHION DEPARTMENT STORES? AN ANALYSIS OF GENERATIONAL COHORTS AND INTENT TO PURCHASE,NO,On Google Drive Folder
366,366 - HUMMEL_S DIGITAL TRANSFORMATION TOWARD OMNICHANNEL RETAILING KEY LESSONS LEARNED.pdf,HUMMEL'S DIGITAL TRANSFORMATION TOWARD OMNICHANNEL RETAILING: KEY LESSONS LEARNED,YES,On Google Drive Folder
367,367 - THE IMPACT OF CROSS-SELLING ON MANAGING CONSUMER RETURNS IN OMNICHANNEL OPERATIONS.pdf,THE IMPACT OF CROSS-SELLING ON MANAGING CONSUMER RETURNS IN OMNICHANNEL OPERATIONS,YES,On Google Drive Folder
368,368 - E-GROCERY LOGISTICS EXPLORING THE GAP BETWEEN RESEARCH AND PRACTICE.pdf,"A 2020 PERSPECTIVE ON ""SPREADING THE WORD: HOW CUSTOMER EXPERIENCE IN A TRADITIONAL RETAIL SETTING IN FLUENCES CONSUMER TRADITIONAL AND ELECTRONIC WORD-OF-MOUTH INTENTION """,YES,On Google Drive Folder
369,,E-GROCERY LOGISTICS: EXPLORING THE GAP BETWEEN RESEARCH AND PRACTICE,NO,On Google Drive Folder
370,370 - TECHNOLOGY ADOPTION FOR THE INTEGRATION OF ONLINE-OFFLINE PURCHASING OMNICHANNEL STRATEGIES IN THE RETAIL ENVIRONMENT.pdf,MOBILITY AND THE MALL: THREE SOLUTION PATHWAYS FOR EFFICIENT AND SUSTAINABLE OMNICHANNEL GOODS TRANSPORTATION FOR A MALL IN PARIS,YES,On Google Drive Folder
371,,TECHNOLOGY ADOPTION FOR THE INTEGRATION OF ONLINE-OFFLINE PURCHASING OMNICHANNEL STRATEGIES IN THE RETAIL ENVIRONMENT,NO,On Google Drive Folder
372,372 - INTEGRATING FIRST-MILE PICKUP AND LAST-MILE DELIVERY ON SHARED VEHICLE ROUTES FOR EFFICIENT URBAN E-COMMERCE DISTRIBUTION.pdf,INTEGRATING FIRST-MILE PICKUP AND LAST-MILE DELIVERY ON SHARED VEHICLE ROUTES FOR EFFICIENT URBAN E-COMMERCE DISTRIBUTION,YES,On Google Drive Folder
373,373 - MULTIROOMING GENERATING E-SATISFACTION THROUGHOUT OMNICHANNEL CONSUMER JOURNEY DESIGN AND ONLINE CUSTOMER EXPERIENCE.pdf,DYNAMIC PRICING OF OMNICHANNEL INVENTORIES,YES,On Google Drive Folder
374,,MULTIROOMING: GENERATING E-SATISFACTION THROUGHOUT OMNICHANNEL CONSUMER JOURNEY DESIGN AND ONLINE CUSTOMER EXPERIENCE,NO,On Google Drive Folder
375,375 - OMNICHANNEL STRATEGY OF DIGITAL TRANSFORMATION OF RETAIL TRADE ENTERPRISE FROM CONCEPT TO IMPLEMENTATION.pdf,ADDITIVE OMNICHANNEL ATMOSPHERIC CUES: THE MEDIATING EFFECTS OF COGNITIVE AND AFFECTIVE RESPONSES ON PURCHASE INTENTION,YES,On Google Drive Folder
376,,OMNICHANNEL STRATEGY OF DIGITAL TRANSFORMATION OF RETAIL TRADE ENTERPRISE: FROM CONCEPT TO IMPLEMENTATION,NO,On Google Drive Folder
377,377 - SHOWROOMING VERSUS WEBROOMING EXAMINING MOTIVATIONAL DIFFERENCES IN OMNICHANNEL EXPLORATORY BEHAVIORS.pdf,SHOWROOMING VERSUS WEBROOMING: EXAMINING MOTIVATIONAL DIFFERENCES IN OMNICHANNEL EXPLORATORY BEHAVIORS,YES,On Google Drive Folder
378,378 - BILEVEL PROGRAMMING FOR MANUFACTURERS OPERATING IN AN OMNICHANNEL RETAILING ENVIRONMENT.pdf,ACCEPTANCE OF IN-STORE APPS: FACTORS THAT INFLUENCE THE INTENTION TO ADOPT LOCATION-BASED RETAIL APPS - INSIGHTS FROM GERMANY,YES,On Google Drive Folder
379,379 - AN INVENTORY MODEL WITH DISCOUNTS FOR OMNICHANNEL RETAILERS OF SLOW MOVING ITEMS.pdf,BILEVEL PROGRAMMING FOR MANUFACTURERS OPERATING IN AN OMNICHANNEL RETAILING ENVIRONMENT,YES,On Google Drive Folder
380,380 - ON-DEMAND LAST-MILE DISTRIBUTION NETWORK DESIGN WITH OMNICHANNEL INVENTORY.pdf,AN INVENTORY MODEL WITH DISCOUNTS FOR OMNICHANNEL RETAILERS OF SLOW MOVING ITEMS,YES,On Google Drive Folder
381,381 - OMNICHANNEL DISTRIBUTION TO FULFILL RETAIL ORDERS.pdf,ON-DEMAND LAST-MILE DISTRIBUTION NETWORK DESIGN WITH OMNICHANNEL INVENTORY,YES,On Google Drive Folder
382,,OMNICHANNEL DISTRIBUTION TO FULFILL RETAIL ORDERS,NO,On Google Drive Folder
383,383 - FACILITY SELECTION MODEL FOR BOPS SERVICE FOR AN OMNICHANNEL RETAIL CHAIN.pdf,ONLINE-EXCLUSIVE OR HYBRID? CHANNEL MERCHANDISING STRATEGIES FOR SHIP-TO-STORE IMPLEMENTATION,YES,On Google Drive Folder
